DATE,IMPORTER,EXPORTER,VESSEL,BL,ORIGIN,QUANTITY,DESCRIPTION,AMOUNT $(CIF), L. COST (PhP) 
5-Dec,TRANS WORLD TRADING CO.INC.,TOYOCHEM SPECIALTY CHEMICAL SDN.BHD,EVER BONNY V1685-008N,EGLV091830512733,MY,14800.00,"( TM-585-60M-DM-PH , TM-570-PH )  ADHESIVE","55,171.52",2916423.00
18-Dec,ASIA PRIMERA KIMIKA INC.,BASF HONGKONG LTD.,SEASPAN HUDSON 009E,HAM015644,DE,400.00,1 PALLET STC GLUADIN WLM BENZ,"12,500.00",674109.00
20-Dec,EATON INDUSTRIES PHILIPPINES LLC,SMADER TECHNOLOGY LIMITED,SELENTIE 18001S,HKG180455368,HK,96.00,1 PK STC ADHESIVE,"4,578.07",260073.00
10-Dec,CHAROEN POKPHAND FOODS PHILS. CORP.,DANISCO SINGAPORE PTE. LTD.,NAVIOS TEMPO,MCB605351,FI,7000.00,1 X 40 CONT STC 16 PALLETS OF FEED ENZYME,"47,047.09",2552640.00
3-Dec,PROCTER & GAMBLE PHILIPPINES INC.,NOVOZYMES A/S,YM WORTH,CPH32102973,DK,10000.00,10 PLTS STC 10 BB OF ECLIPSE 150 T  (ENZYMES,"145,345.05",7880734.00
27-Dec,MEGAWIDE CONSTRUCTION CORPORATION,BUEHNEN GMBH & CO. KG,MILAN MAERSK 843E,1.00E+11,DE,6703.00,11.00 PL HOT MELT SMALL PILLOWS,"34,584.05",1937053.00
26-Dec,INTERNATIONAL CONTAINER TERMINAL,SUMITOMO RUBBER INDUSTRIES LTD,WAN HAI,EGLV022800243766,JP,456.00,1140 UNITS CHEMICAL ANCHOR RG 3021F,"13,680.00",744589.00
14-Dec,AP MAGNA CHEM DISTRIBUTION CORP,CHEM-BASE(NANTONG)LABORATORIES,ROTTERDAM BRIDGE,QIML6102111WFL2,CN,25500.00,1275 BAGS ISOLATED SOY PROTEIN,"41,604.00",2218341.00
19-Dec,PIONEER ADHESIVES INC.,SOUDAL LIMITED,ROTTERDAM BRIDGE 002S,GXSAG18116156,CN,3315.00,17 DRUMS SILICONE SEALANT BOSS 888 TRANS,"14,339.36",766224.00
7-Dec,NITO SEIKI MFG CORP,SPEED PARTS,GROUSE HUNTER V.017N,TMEL4132897,AU,1814.00,"1L, 500ML, 250ML, 20L LIQUID PATCH","10,397.57",577654.00
14-Dec,MAXION BIOSCIENCE INC.,DANISCO SINGAPORE PTE LTD,MP THE BROWN,MCB620759,SG,3000.00,1X20 CONT STC AXTRA XAP 101 TPT (FEED PREMIX,"64,259.88",3484635.00
18-Dec,MONDE NISSIN CORPORATION,GENERAL STARCH LIMITED,CORDELIA 0856-009E,EGLV050801133102,TH,20000.00,1X20 CONT STC MODIFIED TAPIOCA STARCH STAR F,"15,231.34",816621.00
12-Dec,MAXION BIOSCIENCE INC.,DANISCO SINGAPORE PTE LTD,MP THE BROWN,MCB623775,SG,10000.00,1X20 CONT STC PHYZYME XP 10000 TPT FEED PREM,"81,590.00",4431428.00
14-Dec,MAXION BIOSCIENCE INC.,DANISCO SINGAPORE PTE LTD,MP THE LAW,MCB637343,SG,2750.00,1X20 CONT STC PHYZYME XP 10000 TPT FEED PREM,"22,436.14",1219201.00
6-Dec,HAMBURG TRADING CORPORATION,CARGILL DEUTSCHLAND GMBH,MSC DITTE V.842E,578326832,DE,18000.00,1X20 CONTAINER STC: 720 BAGS C TEX 06214 ACE,"15,370.50",842966.00
6-Dec,HAMBURG TRADING CORPORATION,CARGILL BIO CHEMICAL CO LTD,MATTINA,XDFF302389,CN,18950.00,1X20 CONTAINER STC:758 BAGS C STABITEX 05315,"14,691.62",783081.00
3-Dec,HENKEL PHILIPPINES INC.,PT.HENKEL ADHESIVE TECHNOLOGY,NAVIOUS FELICITAS,1.81E+11,ID,4500.00,1X20 CTR STC ADHESIVE TECHNOMELT SUPRA 100,"14,118.48",753362.00
14-Dec,HENKEL PHILIPPINES INC.,PT.HENKEL ADHESIVE TECHNOLOGY,DERBY D,1.81E+11,ID,8000.00,1X20 CTR STC TECHNOMELT SUPRA 100 ADHESIVES,"25,884.96",1372888.00
28-Dec,PROCTER & GAMBLE PHILIPPINES INC.,NOVOZYMES CHINA BIOTECHNOLOGY CO.LT,SILVIA,TSN31103717,CN,8000.00,1X20 STC MEDLEY,"54,591.16",2916965.00
12-Dec,ACS MANUFACTURING CORPORATION,DANISCO SINGAPORE PTE LTD,COSCO DENMARK V. 0PF1WE1MA,ANT1192740,FI,10000.00,1X20 STC.: 500 CARTONS 10 PLTS SMARTENZ 2210,"65,000.00",3533096.00
3-Dec,SHINDENGEN PHILIPPINES CORPORATION,PANASONIC MANUFACTURING AYUTHAYA  C,SITC SHANGHAI 1831N,ONEYBKKUD3084500,TH,11880.00,1X20RF COMPOUNDED PLASTIC,"48,423.49",2633387.00
11-Dec,ARIELA MARKETING CO. INC.,AVEVE BIOCHEM NV,MSC DITE V.842E,BRSEBOE14748,BE,25000.00,1X40 CONTAINER STC: 20 PALLETS AVEMIX 02CS,"207,500.00",11272016.00
13-Dec,HENKEL PHILIPPINES INC.,HENKEL ADHESIVES TECHNOLOGIES,CALICANTO BRIDGE 268E,SSGN2630538330,VN,18000.00,1X40 CTR STC LOCTITE BONDACE 7103 LTF (E) AD,"45,900.00",2445545.00
13-Dec,HENKEL PHILIPPINES INC.,HENKEL ADHESIVES TECHNOLOGIES,CALICANTO BRIDGE 268E,SSGN2630538337,VN,18000.00,1X40 CTR STC LOCTITE BONDACE 7103 LTF (E) AD,"45,720.00",2436023.00
5-Dec,HENKEL PHILIPPINES INC.,HENKEL CHEMICAL TECHNOLOGIES,JEPPESEN MAERSK,SHA530955,CN,10000.00,1X40 CTR STC TECHNOMELT 3183 HOTMELT ADHESIV,"22,484.40",1192249.00
21-Dec,PROMESSO BUSINESS SOLUTIONS,SHANDONG YUXIN BIO TECH CO LTD,JOSEPHINE MAERSK V 894W,MCB627669,CN,20000.00,1X40 STC 1000 BAGS ISOLATED SOY PROTEIN,"43,028.00",2301995.00
19-Dec,INGREDION PHILIPPINES INC.,INGREDION INCORPORATED,MOL PARTNER V 108W,6.32E+13,US,18371.00,1X40GE CNTR STC THERMTEX TRUETRACE IP,"21,160.40",1168789.00
19-Dec,INGREDION PHILIPPINES INC.,INGREDION INCORPORATED,YM MODERATION V 042W,6.32E+13,US,18938.00,1X40GE STC NATIONAL 711 NATIONAL 912 WNA,"19,831.42",1096365.00
26-Dec,INGREDION PHILIPPINES INC.,INGREDION INCORPORATED,MEISHAN BRIDGE V 002W,6.32E+13,US,18371.00,1X40GE STC THERMTEX TRUETRACE  9MODIFIED COR,"21,160.40",1171603.00
26-Dec,INGREDION PHILIPPINES INC.,INGREDION INCORPORATED,MEISHAN BRIDGE V 002W,6.32E+13,US,18280.00,1X40GE STC THERMTEX TRUETRACE IP (MODIFIED C,"21,068.93",1166607.00
18-Dec,INGREDION PHILIPPINES INC.,INGREDION INCORPORATED,YM MODERATION V 042W,6.32E+13,US,18371.00,1X40GE STC ULTRA TEX 4 FOOD STARCH MODIFIED,"35,548.68",1952884.00
6-Dec,CHEMICAL RESEARCH PRODUCTS,PRO TECH USA LC,GEORG MAERSK /840,SES000004080,US,1800.00,2 PLTS STC: MAGNA ZYME DEX; MAGNA ZYME DEX,"19,206.00",1046871.00
6-Dec,SKL MAINTENANCE SYSTEMS CORPORATION,CHESTERTON INTERNATIONAL INC,GEORG MAERSK V840,NYCMNLD10707,US,191.00,24 PCS. 860 MPG KIT RESIN CEMENTS MASTICS,"6,032.14",333997.00
3-Dec,SHINDENGEN PHILIPPINES CORPORATION,PANASONIC MANUFACTURING AYUTHAYA  C,CALICANTO BRIDGE 268E,ONEYBKKUD3083400,TH,23760.00,2X20RF EPOXY ENCAPSULATION MATERIAL,"89,383.42",4856201.00
13-Dec,MEGA SOFT HYGIENIC PRODUCTS INC.,SHENZHEN GUI HAO CHENG TRADE,CAPE MAHON,TYSD011811230003,CN,41172.00,2X40 HC STC ADHESIVE DM2847,"50,319.54",2690043.00
12-Dec,MEGA SOFT HYGIENIC PRODUCTS INC.,SHENZHEN GUI HAO CHENG TRADE,G ACE,1308503519,CN,42551.00,"2X40 HC STC ADHESIVE H4394, TEP517, TEP876","54,525.88",2896165.00
5-Dec,KAMBAL INDUSTRIAL SUPPLY,FLOOR CHEM ASIA CO. LTD.,SITC LIAONING,B181130761,TH,6000.00,300 UNIT OF INDUSTRIAL POLYURETHANE FLOOR CO,"9,238.00",493618.00
5-Dec,HAMBURG TRADING CORPORATION,CARGILL DEUTSCHLAND GMBH,MSC DITTE V.842E,578326847,DE,54000.00,3X20 CONTAINER STC: 2160 BAGS C TEX 06214 AC,"46,111.50",2516267.00
5-Dec,THE PUREFOODS HORMEL COMPANY INC,SMS CORPORATION CO LTD,GUAYAQUIL BRIDGE,ONEYBKKUD6009500,TH,72000.00,3X40 MODIFIED TAPIOCA STARCH KREATION 20 CL,"53,691.37",2861992.00
19-Dec,THE PUREFOODS HORMEL COMPANY INC,SMS CORPORATION CO LTD,GUAYAQUIL BRIDGE,ONEYBKKUD6017400,TH,96000.00,4X40 MODIFIED TAPIOCA STARCH KREATION 20CL,"71,588.89",3836913.00
12-Dec,GLONICOR FOOD CORPORATION,TATE & LYLE INGREDIENTS AMERIC,ONE STORK 002W,ONEYRICUQ5274600,US,19278.00,50# REZISTA 682 STARCH,"19,090.47",1052650.00
19-Dec,MC RITZ INTERNATIONAL CORPORATION,E H M INTERTRADING CO. LTD,MOUNT NOCHOLSON 020N,GTD0426164,TH,100000.00,"5X20 4,000 BAGS MODIFIED TAPIOCA STARCH","44,211.76",2373120.00
14-Dec,PROMESSO BUSINESS SOLUTIONS,TAIXING ZHONGXING IMP AND EXP CO L,NAVIOS VERANO V 007S,SHMNN1811000907,CN,3000.00,6 PALLETS STC 300 CARTONS TRANSGLUTAMINASE,"29,978.00",1641036.00
3-Dec,PROCTER & GAMBLE PHILIPPINES INC.,NOVOZYMES CHINA BIOTECHNOLOGY CO LT,ALS FLORA 003S,TSN32101364,CN,6000.00,6 PALLETS STC MEDLEY BL 91667020 S 321 T,"40,855.64",2156009.00
3-Dec,PROCTER & GAMBLE PHILIPPINES INC.,NOVOZYMES CHINA BIOTECHNOLOGY CO LT,TENG YUN HE 237S,TSN32101376,CN,6000.00,6 PALLETS STC MEDLEY BL 91667020 S 321 T,"40,855.64",2156009.00
11-Dec,UNITED PULP AND PAPER CO INC,NATIONAL STARCH AND CHEMICAL (THAIL,GUAYAQUIL BRIDGE,ONEYBKKUD4506500,TH,108000.00,6X20 MODIFIED STARCH,"88,605.00",4697437.00
28-Dec,PROCTER & GAMBLE PHILIPPINES INC.,NOVOZYMES A S,MSC ERICA,CPH32103044,DK,8000.00,8 PLTS STC ECLIPSE,"118,214.82",6490105.00
28-Dec,INGREDION PHILIPPINES INC.,INGREDION INC. 5 WESTBROOK,ONE STORK 002W,6.32E+13,US,18371.00,810 BAGS OF THERMTEX MODIFIED STARCH,"21,160.40",1177296.00
14-Dec,UNITED PULP AND PAPER CO INC,NATIONAL STARCH AND CHEMICAL (THAIL,SITC LIAONING V.1839N,ONEYBKKUF6653500,TH,144000.00,8X20 MODIFIED STARCH,"128,079.78",6822782.00
5-Dec,DOLE PHILIPPINES INC,NOVOZYMES MALAYSIA SDN BHD,CMA CGM VERDI/0IL0SE1PL,01PKG0165972,MY,960.00,PECTINEX ULTRA TROPICAL,"9,812.00",554049.00
10-Dec,ERCM PRODUCTS INTERNATIONAL INC.,"CHUEN HUAH CHEMICAL CO.,LTD",MARIA SCHULTE V-308S,KAOMNNT15418Y02,TW,12960.00,A456 FLEXIBLE CEMENTITOUS (BLACK),"17,496.00",977528.00
4-Dec,BRENNTAG INGREDIENTS INC.,BRENNTAG TAIWAN CO LTD,SINGAPORE V 051S,KEEMNS18110117,IT,2000.00,ACETYLATED DISTARCH ADIPATE CLEARAM CH 40,"3,569.00",199231.00
28-Dec,IGROS MARKETING CORPORATION,DGL INTERNATIONAL MALAYSIA SDN,PL GERMANY V. 067E,COAU7121380950,MY,16848.00,ACRATEX 965 ACRALITE COL. WHITE (PAINT),"17,434.96",984717.00
7-Dec,CHOEI PLASTIC WORLD PHILIPPINES INC,PLASTIC WORLD (CHINA) LTD,TRF KAYA 18004S,2.11E+11,HK,45.00,ADDITIVES,"4,780.21",285726.00
6-Dec,GILVAN PACKAGING CORPORATION,MORCHEM S.A ON BEHALF OF,YANTIAN EXPRESS,BCN11002029,ES,16000.00,ADHESIVE,"16,540.80",924855.00
4-Dec,DEZIGN WORKS PHILIPPINES INC,MILLIKEN HOLDINGS (HONGKONG)CO.LIMI,G. ACE 1820S,I236051565,CN,388.00,ADHESIVE,"4,419.18",249442.00
14-Dec,HENKEL PHILIPPINES INC.,BENORE LOGISTICS FOR HENKEL US,APL COLUMBUS 308W,HOU028813,US,1331.00,ADHESIVE (TECHNOMELT DM 519A BLUE),"12,558.64",703992.00
12-Dec,SANKYOTATEYAMA PHILIPPINES INC,"SANKYO TATEYAMA,INC.",NASIA 180S,ONEYNG8BC2516500,JP,246.00,"ADHESIVE 3000RX, BOTH SIDES ADHESIVE TAPE 50","3,862.96",213809.00
21-Dec,DYSON ELECTRONICS PTE LTD PH BRANCH,VITROCHEM TECHNOLOGY PTE LTD,XIN QIN HUANG DAO V. 48E,GALSE181203001,SG,126.00,ADHESIVE ARALDITE 2022 PART A,"18,883.72",1051013.00
21-Dec,DYSON ELECTRONICS PTE LTD PH BRANCH,VITROCHEM TECHNOLOGY PTE LTD,XIN QIN HUANG DAO V. 48E,GALSE181203001,SG,158.00,ADHESIVE ARALDITE 2022 PART B,"23,604.67",1312968.00
10-Dec,TDK PHILIPPINES CORPORATION,"TDK HONGKONG CO., LTD.",TRF KAYA 18004S,5.20E+11,HK,78.00,ADHESIVE DISPENSER AND ETC.,"8,331.15",460690.00
13-Dec,JT INTERNATIONAL ASIA MFG. CORP.,H.B. FULLER ADHESIVES MALAYSIA SDB,BUXMELODY 1687 104N,PKGMNL18110003,MY,5450.00,"ADHESIVE DURABOND HM3346, PC8888-CONT","11,820.27",660068.00
14-Dec,SAN TECHNOLOGY INCORPORATED,CORAL SERVICE CORP.,NASIA 180S,UKBMNL18115412,JP,1982.00,ADHESIVE POWDER,"33,638.87",1823811.00
4-Dec,ADAMPAK & PRINT (PHILS.) INC.,AVERY DENNISON SINGAPORE,CMA CGM VERDI V.0IL0SE1PL,SEMNL5009142,SG,904.00,ADHESIVE TAPES TAPES-NON WOVEN LAMINATING MO,"6,586.81",367966.00
27-Dec,YAZAKI-TORRES MANUFACTURING INC.,YAZAKI  CORPORATION,NYK SILVIA 0505S,ONEYSM8BB3666400,JP,644.00,"ADHESIVE, ARONALPHA, CORETEX, E-TEC, ETC","14,529.51",811398.00
11-Dec,YAZAKI-TORRES MANUFACTURING INC.,YAZAKI  CORPORATION,NASIA 180S,ONEYSM8BB3501600,JP,613.00,"ADHESIVE, CORETEX, E-TEC","12,747.03",706185.00
19-Dec,YAZAKI-TORRES MANUFACTURING INC.,YAZAKI  CORPORATION,IRENES RESPECT 0007S,ONEYSM8BB3909400,TH,492.00,"ADHESIVE, CORETEX, E-TEC","10,258.98",572182.00
19-Dec,YAZAKI-TORRES MANUFACTURING INC.,YAZAKI  CORPORATION,IRENES RESPECT 0007S,ONEYSM8BB3909401,JP,568.00,"ADHESIVE, CORETEX, E-TEC","10,113.15",563271.00
11-Dec,NAN PAO RESINS CHEMICAL PHILIPPINES,EASTLION ENTERPRISES LTD,TRF KAYA 18004S,PTMNS1812010,CN,19950.00,ADHESIVES 317NT,"52,016.25",2749119.00
28-Dec,NAN PAO RESINS CHEMICAL PHILIPPINES,EASTLION ENTERPRISES LTD,URU BHUM 18004S,PTMNN1812012,CN,6000.00,ADHESIVES A362,"17,338.07",927539.00
28-Dec,NAN PAO RESINS CHEMICAL PHILIPPINES,EASTLION ENTERPRISES LTD,URU BHUM 18004S,PTMNN1812012,CN,2000.00,ADHESIVES A700W,"7,504.54",402564.00
6-Dec,NAN PAO RESINS CHEMICAL PHILIPPINES,EASTLION ENTERPRISES LTD,CAPE MAHON 18012S,PTMNN1811023,CN,1500.00,ADHESIVES A700W,"5,649.80",299723.00
11-Dec,NAN PAO RESINS CHEMICAL PHILIPPINES,EASTLION ENTERPRISES LTD,TRF KAYA 18004S,PTMNS1812010,CN,19950.00,ADHESIVES NP 71KN,"40,194.37",2125321.00
6-Dec,NAN PAO RESINS CHEMICAL PHILIPPINES,EASTLION ENTERPRISES LTD,CAPE MAHON 18012S,PTMNN1811023,CN,10500.00,ADHESIVES NP 71KN,"21,251.68",1123272.00
28-Dec,NAN PAO RESINS CHEMICAL PHILIPPINES,EASTLION ENTERPRISES LTD,URU BHUM 18004S,PTMNN1812012,CN,2550.00,ADHESIVES NP 71KN,"5,141.58",276431.00
6-Dec,NAN PAO RESINS CHEMICAL PHILIPPINES,EASTLION ENTERPRISES LTD,CAPE MAHON 18012S,PTMNN1811022,CN,19950.00,ADHESIVES P049,"40,809.96",2270289.00
21-Dec,DYSON ELECTRONICS PTE LTD PH BRANCH,VITROCHEM TECHNOLOGY PTE LTD,XIN QIN HUANG DAO V. 48E,GALSE181203001,SG,241.00,ADHESIVEíË - HUNTSMAN 2014-1,"36,084.74",2005456.00
21-Dec,DYSON ELECTRONICS PTE LTD PH BRANCH,VITROCHEM TECHNOLOGY PTE LTD,XIN QIN HUANG DAO V. 48E,GALSE181203001,SG,1059.00,ADHESIVEíË - HUNTSMAN 2014-2,"19,603.55",1091136.00
5-Dec,H B FULLER PHILS INC,H. B. FULLER (CHINA) ADHESIVES LTD.,NAVIOS AMARILLO 024S,APLU051919226,CN,8000.00,ADVANTRA 8621 (HOT MELT ADHESIVES),"21,655.51",1146583.00
5-Dec,H B FULLER PHILS INC,H. B. FULLER (CHINA) ADHESIVES LTD.,NAVIOS AMARILLO 024S,APLU051919226,CN,8000.00,ADVANTRA PHC 9256 (HOT MELT ADHESIVES),"27,694.89",1465016.00
14-Dec,KINTETSU LOGISTICS (PHILS) INC.,SHIRAISHI CALCIUM (THAILAND) CO LTD,SITC LIAONING 1839N,SITDLCMN147608,TH,1600.00,AKTIPLAST T,"7,691.24",429420.00
18-Dec,ALLTECH BIOTECHNOLOGY CORP.,ALLTECH BIOTECHNOLOGY CORP LTD,CORDELIA 0856 009E,EGLV050801122224,TH,6000.00,ALLZYME SSF E,"49,136.97",2686802.00
6-Dec,ALLTECH BIOTECHNOLOGY CORP.,ALLTECH BIOTECHNOLOGY CORP LTD,LISBON 835S,DMCQBKKH018859,TH,4000.00,ALLZYME SSF E,"33,022.73",1794472.00
11-Dec,ALLTECH BIOTECHNOLOGY CORP.,"CUSTOM FREIGHT SALES, INC.",EVER LISSOME 027W,CVGMNN8912155D,US,3000.00,ALLZYME VEGPRO ALLZYME FD,"20,138.24",1099066.00
10-Dec,HENKEL PHILIPPINES INC.,HENKEL (MALAYSIA) SDN BHD,EVER BONNY 1685-0085N,1.81E+11,MY,1890.00,AQUENCE KL 242-3051 210KG,"3,833.56",207565.00
13-Dec,GLOSCORE PHILIPPINES CONSTRUCTION,ARDEX SINGAPORE PTE LTD,KOTA JUTA V0340E,SGMNL1802852,SG,1875.00,ARDEX R2SE,"10,334.00",577810.00
14-Dec,MAXION BIOSCIENCE INC.,DANISCO SINGAPORE PTE LTD,MP THE BROWN,MCB620759,SG,1000.00,AXTRA PHY 10000 TPT ( FEED PREMIX POWDER ENZ,"15,299.97",833265.00
14-Dec,MAXION BIOSCIENCE INC.,DANISCO SINGAPORE PTE LTD,MP THE LAW,MCB637343,SG,500.00,AXTRA PHY 10000 TPT FEED PREMIX POWDER ENZYM,"7,648.68",418028.00
19-Dec,FOOD INDUSTRIES INC.,INGREDION INC.,MOL PARTNER V 108W,6.32E+13,US,18371.00,BAKA-SNAK,"34,652.02",1904018.00
6-Dec,UNIVERSAL ROBINA CORPORATION,SCIENCE TECHNICS SDN BHD,MP THE BROWN 847W,4.51E+13,MY,350.00,BAKE PLUS T,"4,945.96",266226.00
14-Dec,INGREDION PHILIPPINES INC.,INGREDION INC. 5 WESTBROOK,YM MODERATION 042W,6.32E+13,US,18371.00,BATTERBIND S (TRUETRACE IP),"17,471.42",963644.00
14-Dec,INGREDION PHILIPPINES INC.,INGREDION INC. 5 WESTBROOK,ALEXANDRA 830W,6.32E+13,US,18371.00,BATTERBIND S (TRUETRACE IP),"17,471.42",963644.00
17-Dec,NESTLE PHILIPPINES INC.,NESTLE USA INC,IRENES RESPECT 0007,ONEYRICUT9012800,US,2179.00,BENEPROTEIN 6X8OZ N1 XI,"36,242.38",1947877.00
6-Dec,M2 ADVANCE TECH. INC.,DE NEEF CONSTRUCTION CHEMICALS,MAERSK HERRERA,HDMUAWML0910589,BE,9990.00,BENTORUB 20X25MMX30MM WATER PROOFING MATERIA,"12,180.20",683136.00
27-Dec,GREYHOUND INDUSTRIAL SALES,INTERNATIONAL COMPANY FOR,CALICANTO BRIDGE 269N,COSU4514176230,EG,18193.00,BITUPROOF APP WATERPROOFING MEMBRANE 4MM PES,"6,427.06",364611.00
6-Dec,STT PHILIPPINES INC,"ELKEM SILICONES SHANGHAI CO.,",G ACE 1820S,SITGSHMNL02239,CN,12000.00,"BLUESIL TCS 7525AR, BLUESIL TCS 7525 B","120,960.00",6689343.00
18-Dec,STT PHILIPPINES INC,"ELKEM SILICONES SHANGHAI CO.,",SITC DAVAO 1830S,SITGSHMNL02243,CN,12000.00,BLUESIL TCS 7525AR/B,"120,960.00",6730161.00
17-Dec,INTERNATIONAL WIRING SYSTEMS PHILS,SIIX CORPORATION,IRENES RESPECT 0007S,ONEYNG8BC1661500,JP,196.00,BOND,"4,181.98",236149.00
12-Dec,INTERNATIONAL WIRING SYSTEMS PHILS,SIIX CORPORATION,NASIA 180S,ONEYNG8BC1243800,JP,159.00,BOND,"3,680.18",205287.00
27-Dec,INTERNATIONAL WIRING SYSTEMS PHILS,SIIX CORPORATION,NYK SILVIA 0505S,ONEYNG8BC1244900,JP,154.00,BOND,"3,315.04",189538.00
11-Dec,INTERNATIONAL WIRING SYSTEMS PHILS,SIIX CORPORATION,NASIA 180S,ONEYNG8BC1242700,JP,148.00,BOND,"3,159.64",177602.00
12-Dec,PIONEER ADHESIVES INC.,FOSROC CONSTRUCTION CHEMICALS,CMA CGM VERDI V. 0IL0SE1PL,FPKJE18110095,MY,5000.00,BRUSHBOND TGP,"3,588.26",192601.00
5-Dec,CARGILL TEXTURIZING SOLUTIONS,CARGILL DEUTSCHLAND GMBH,SINGAPORE V. 0151S,OOLU2103897970,BE,29650.00,C HIFORM 12748 COLD SWEL HYDROX DSTARCH PHOS,"76,793.50",4187102.00
12-Dec,HAMBURG TRADING CORPORATION,CARGILL BIO CHEMICAL CO LTD,ARGOS V.1NC,XDFF302580,CN,18750.00,C STABITEX 05311 DISTARCH PHOSPHATE,"13,942.88",743992.00
12-Dec,HAMBURG TRADING CORPORATION,CARGILL DEUTSCHLAND GMBH,TR PORTHOS V.1801,578326848,NL,17000.00,C TEX 06205 ACETYLATED DISTARCH ADIPATE,"15,027.30",824907.00
28-Dec,CARGILL TEXTURIZING SOLUTIONS,CARGILL DEUTSCHLAND GMBH,CALICANTO BRIDGE V. 269N,VLSANR000085822,BE,1000.00,C*ARASET 75701 HYDROXYPROPYL STARCH,"4,951.57",277480.00
27-Dec,FORGEMS MARKETING CO. INC.,GRAIN PROCESSING CORPORATION,OOCL GENEO V.028W,GLR50881001,US,36740.00,C12F ACID MODIFIED CORN STARCH,"19,406.36",1087773.00
6-Dec,FORGEMS MARKETING CO. INC.,GRAIN PROCESSING CORPORATION,XIN SHANGHAI V.107S,GLR50448401,US,18370.00,C12F ACID MODIFIED CORN STARCH,"9,620.56",537914.00
28-Dec,FORGEMS MARKETING CO. INC.,GRAIN PROCESSING CORPORATION,OOCL MIAMI V.050W,GLR51008801,US,18370.00,C12F ACID MODIFIED CORN STARCH PLAIN BROWN 5,"9,703.18",546794.00
5-Dec,ALASKA MILK CORPORATION,WESTLAND CO-OPERATIVE DAIRY,MAERSK VIRGINIA V.885N,606112426,NZ,75600.00,CASEIN ACID 30/60 MESH,"475,955.35",25068624.00
27-Dec,SANTIENZ PHILS. INC.,CREATIVE ANALYSIS SDN BHD,XIN QIN HUANG DAO V.048E,SNKO160181200037,MY,40231.00,"CCRETE SL (PART C) IN 560 BAGS X 50KG, CCRET","10,068.28",571325.00
21-Dec,TS TECH TRIM PHILS. INC.,ITOCHU PLASTICS INC.,IRENES RESPECT 0007S,YOKMNL181110021,JP,1620.00,CEMEDINE ADHESIVE,"17,213.21",962819.00
19-Dec,HOUSE TECHNOLOGY INDUSTRIES PTE.LTD,HRD SINGAPORE PTE LTD,IRENES RESPECT 0007S,ONEYSM8BB3974600,JP,24660.00,CEMEDINE TILE EPOXY 50KG/SET,"132,352.22",7372597.00
18-Dec,IMCD PHILIPPINES CORPORATION,KMC KARTOFFELMELCENTRALEN AMBA,THALASSA PATRIS V.0999-024E,EGLV504800013870,DK,24750.00,CHEESEMAKER HIGHMELT (MODIFIED POTATO STARCH,"35,887.50",1972826.00
4-Dec,BRENNTAG INGREDIENTS INC.,ROQUETTE ITALIA SPA,COSCO SHIPPING V 002E,APLU709091751,IT,19000.00,CLEARAM CH 20 20,"20,698.56",1132395.00
4-Dec,BRENNTAG INGREDIENTS INC.,ROQUETTE ITALIA SPA,COSCO SHIPPING V 002E,APLU709091750,IT,19000.00,CLEARAM CH 20 20,"20,698.56",1132395.00
27-Dec,BRENNTAG INGREDIENTS INC.,ROQUETTE ITALIA SPA,CMA CGM MUSCA,AZT0100831,IT,19000.00,CLEARAM CH 40 20,"24,342.96",1346108.00
11-Dec,KINTETSU LOGISTICS (PHILS) INC.,SHIRAISHI CALCIUM (SHANGHAI) INTERN,G. ACE 1820S,SNL8SHPL0300007,CN,10800.00,COLOR PASTE,"33,094.28",1838814.00
14-Dec,RICHMOND WATERPROOFING INC,XYPEX CHEMICAL CORP,KYOTO EXPRESS,YVRMNLI00157,CA,16828.00,CONCRETE WATERPROOFING PRODUCTS,"19,684.15",1106520.00
10-Dec,CHAROEN POKPHAND FOODS PHILS. CORP.,DANISCO SINGAPORE PTE. LTD.,NAVIOS TEMPO,MCB605351,FI,3000.00,DANISCO ANIMAL NUTIRITION LIQUID SUBTILISIN,"30,841.19",1674758.00
10-Dec,CHAROEN POKPHAND FOODS PHILS. CORP.,DANISCO SINGAPORE PTE. LTD.,NAVIOS TEMPO,MCB605351,BE,3000.00,DANISCO ANIMAL NUTRITION LIQUID ALPHA-AMYLAS,"20,744.37",1127819.00
10-Dec,CHAROEN POKPHAND FOODS PHILS. CORP.,DANISCO SINGAPORE PTE. LTD.,NAVIOS TEMPO,MCB605351,FI,3000.00,DANISCO XYLANASE 40000 L,"54,951.16",2980789.00
27-Dec,GCP APPLIED TECHNOLOGIES,HENKEL TECHNOLOGY CORPORATION,ONE STORK 002W,HOU030152,US,9960.00,DAREX WBC 4208-66-4,"19,774.44",1112336.00
5-Dec,GCP APPLIED TECHNOLOGIES,HENKEL (THAILAND) LIMITED,SITC SHANGHAI 1831N,ONEYBKKUE4124900,TH,12000.00,DAREX WBC733 CON,"24,480.00",1290714.00
19-Dec,WU KONG SINGAPORE PTE. LTD. PHIL.,HRD SINGAPORE PTE LTD,IRENE RESPECT 0007S,ONEYSM8BB3966700,JP,12730.00,DEERNOL D-40E OSHIKA CORPORATION,"47,751.58",2677392.00
5-Dec,DIAMOND DRY MORTAR INC.,AALBORG PORTLAND MALAYSIA SDN,EVER BEING,ICLMNL1811022,MY,48600.00,DIAMOND FINISH COAT WHITE,"7,689.65",421291.00
6-Dec,HAMBURG TRADING CORPORATION,CARGILL BIO CHEMICAL CO LTD,MV MATINA V.31N1,XDFF302572,CN,18725.00,DISTARCH PHOSPHATE,"18,817.13",1000305.00
20-Dec,ELEVENTH TRADING,DOW CHEMICAL SILICONES KOREA,STARSHIP PEGASUS,PUSB127917,KR,10679.00,"DOWSIL SILICONE SEALANT BRONZE, BLACK","10,499.00",595276.00
19-Dec,ELEVENTH TRADING,DOW CHEMICAL SILICONES KOREA,STARSHIP PEGASUS,PUSB126897,KR,9193.00,"DOWSIL SILICONE SEALANT BRONZE, BLACK, WHITE","10,550.00",596684.00
20-Dec,ELEVENTH TRADING,DOW CHEMICAL SILICONES KOREA,STARSHIP PEGASUS,PUSB124902,KR,10679.00,"DOWSIL SILICONE SEALANT BRONZE, CLEAR, WHITE","10,499.00",595276.00
18-Dec,ELEVENTH TRADING,DOW CHEMICAL SILICONES KOREA,STARSHIP PEGASUS,PUSB124912,KR,10679.00,"DOWSIL SILICONE SEALANT BRONZE, CLEAR, WHITE","9,433.10",534389.00
5-Dec,ELEVENTH TRADING,DOW CHEMICAL SILICONES KOREA,GREEN ACE,PUSB061497,KR,10679.00,"DOWSIL SILICONE SEALANT BRONZE, WHITE","9,489.20",534303.00
19-Dec,ELEVENTH TRADING,DOW CHEMICAL SILICONES KOREA,STARSHIP PEGASUS,PUSB121909,KR,10679.00,"DOWSIL SILICONE SEALANT BRONZE, WHITE CLEAR","10,550.00",596684.00
18-Dec,ELEVENTH TRADING,DOW CHEMICAL SILICONES KOREA,STARSHIP PEGASUS,PUSB127895,KR,9193.00,"DOWSIL SILICONE SEALANT BRONZE, WHITE CLEAR","9,428.00",534104.00
27-Dec,ELEVENTH TRADING,DOW CHEMICAL SILICONES KOREA,HEUNG-A GREEN,PUSB087754,KR,10679.00,"DOWSIL SILICONE SEALANT BRONZE, WHITE GRAY","10,958.00",623140.00
4-Dec,ALTERNATIVES FOOD CORP,"QINGDAO CPI INTERNATIONAL CO., LTD.",MATTINA,AAJY010718,TR,150000.00,EMPRO 90 ISOLATED SOY PROTEIN (EMULSION GRA,"157,200.00",8437773.00
12-Dec,ALTERNATIVES FOOD CORP,"QINGDAO CPI INTERNATIONAL CO., LTD.",ARGOS,AAJY010777,TR,150000.00,EMPRO 90 ISOLATED SOY PROTEIN (EMULSION GRA,"157,200.00",8440797.00
21-Dec,ALTERNATIVES FOOD CORP,"QINGDAO CPI INTERNATIONAL CO., LTD.",MAERSK JAIPUR,GOSUQIN3775075,TR,150000.00,EMPRO 90 ISOLATED SOY PROTEIN (EMULSION GRA,"157,200.00",8488864.00
4-Dec,ALTERNATIVES FOOD CORP,"QINGDAO CPI INTERNATIONAL CO., LTD.",JPO VELA,AAJY010646,TR,100000.00,EMPRO 90 ISOLATED SOY PROTEIN (EMULSION GRA,"104,800.00",5628347.00
14-Dec,AMPERE RESOURCES CORPORATION,SPECIFIED TECHNOLOGIES INC.,EVER LAWFUL / 030,S00390585,US,2272.00,ENDOTHERMIC FIRESTOP SEALANT,"18,975.48",1051308.00
21-Dec,AMPERE RESOURCES CORPORATION,SPECIFIED TECHNOLOGIES INC.,GERD MAERSK 841,S00388644,US,5868.00,ENDOTHERMIC FIRESTOP SEALANT WORN WHITE,"38,083.61",2122789.00
28-Dec,FABCON PHILS. INC.,CATALYSTS BIO TECHNOLOGIES PVT,NYK ARTEMIS V.102E,DELMNLCSSI141100,IN,6000.00,"ENZYDEX PS BATCH CBL1296, 1297, 1304, 1305,","64,800.00",3565195.00
12-Dec,WORLD HOME DEPOT CORPORATION,PT.APLUS PACIFIC,ACX DIAMOND 216N,KCAJKTMNN029618,ID,19919.00,EUROBOARD JOINT COMPOUND @20KG 1000 BAG,"4,451.30",241707.00
19-Dec,SCAD SERVICES (S) PTE. LTD. - PHIL,HRD SINGAPORE PTE LTD,IRENES RESPECT 0007S,ONEYSM8BB3966704,JP,372.00,EVERGRIP 555Z-NT-2 15KG/CAN(VOC TYPE) (ADHES,"3,222.90",183581.00
7-Dec,FISCHER PH ASIA INC,FISCHERWERKE GMBH & CO KG,SEASPAN THAMES SAC3530,STRMNLI02011,DE,3656.00,"FIS VS 360 S, RM II 10 CAPSULES, RM II 12 CA","43,492.32",2401522.00
4-Dec,FISCHER PH ASIA INC,ISPO FRANCE,MSC MAYA 841E,966542485,BE,19779.00,FISCHER DPU 600 ML GREY,"76,154.25",4221816.00
27-Dec,FISCHER PH ASIA INC,FISCHERWERKE GMBH & CO KG,NYK VIRGO ONE0190,STRMNLI02184,DE,1875.00,FIXING MATERIAL (FFB-ES/R - FIBEBARR ELASTOS,"13,601.66",766660.00
7-Dec,FISCHER PH ASIA INC,FISCHERWERKE GMBH AND CO KG,NYK IBIS,STRMNLI02091,DE,1275.00,FIXING MATERIAL (FIS SB 390 S RM II 16 E CAP,"19,332.78",1074544.00
27-Dec,FISCHER PH ASIA INC,FISCHERWERKE GMBH AND CO KG,NYK VIRGO ONE0190,STRMNLI02217,DE,1270.00,FIXING MATERIALFFB ES/R FIREBARR ELASTOSEAL,"21,167.60",1180341.00
21-Dec,PIONEER ADHESIVES INC.,AKKIM  YAPI KIMYASALLARI,CORDELIA V. 0858-010W,EGLV594800155777,TR,18980.00,FLEXOSEAL PU SEALANT SAUSAGE 600MLGREY (20),"58,038.35",3249006.00
4-Dec,C.T.P. INDUSTRIES INC.,JINAN ZHIBI INTERNATIONAL,DANU BHUM V. 402S,AMIGL180594086A,CN,2000.00,FLY GLUE,"6,063.12",341027.00
27-Dec,HILTI PHILIPPINES INC.,HILTI AG,COSCO DENMARK 025 E,OOLU2611297970,SG,17330.00,FS JOINT FILLER CP 606,"48,609.11",2723911.00
21-Dec,HILTI PHILIPPINES INC.,HILTI AG,EVER GIVEN 001 E,OOLU2611541430,DE,8894.00,FS JOINT FILLER CP 606,"27,068.85",1524379.00
21-Dec,NAN PAO RESINS CHEMICAL PHILIPPINES,NAN PAO RESINS CHEMICAL CO   LTD,SINGAPORE 054S,0018D49470,TW,450.00,FW PRODUCTS 1071 S,"3,186.00",178716.00
21-Dec,NAN PAO RESINS CHEMICAL PHILIPPINES,NAN PAO RESINS CHEMICAL CO   LTD,SINGAPORE 054S,0018D49470,TW,1500.00,FW PRODUCTS HM 170,"7,995.00",446793.00
21-Dec,NAN PAO RESINS CHEMICAL PHILIPPINES,NAN PAO RESINS CHEMICAL CO   LTD,SINGAPORE 054S,0018D49470,TW,1500.00,FW PRODUCTS NP 71KN,"3,180.00",178397.00
21-Dec,NAN PAO RESINS CHEMICAL PHILIPPINES,NAN PAO RESINS CHEMICAL CO   LTD,SINGAPORE 054S,0018D49470,TW,338.00,FW PRODUCTS RFE,"7,204.50",402729.00
10-Dec,TIGER RESORT LEISURE AND ENTERTAINM,TWO NINE SIX O TRADING PTE LTD,LOS ANDES BRIDGE 109N,SE1811004002,SG,2209.00,GE ULTRAPRUF II SCS2903 ETC.,"15,015.63",836148.00
28-Dec,INGREDION PHILIPPINES INC.,INGREDION INC. 5 WESTBROOK,ALEXANDRA 830W,6.32E+13,US,18812.00,"GEL N MELT FOOD MODIFIED CORN STARCH, 630 BA","22,793.27",1266834.00
21-Dec,SUCERE FOODS CORPORATION,ROUSSELOT (M) SDN BHD,EVER BONNY 009N,SNKO061181200190,BR,20000.00,GELATIN 220 H 20,"122,344.00",6700367.00
14-Dec,INTERPHIL LABORATORIES INC,LAPI GELATIN  SPA,LOBIVIA 079E,HLCUEUR1809AOVK4,IT,10075.00,GELATINE 150 BLOOM CALFSKIN,"74,913.45",4066907.00
20-Dec,ACE PREMIUM GOODS CORPORATION,"BLRNE INTERNATIONAL CO., LTD",AS PENELOPE V.1821S,NBMNNT14548T01,CN,1000.00,GLUE,"4,163.17",235039.00
18-Dec,TAIPHIL PROTECH INDUSTRIAL INC.,NEW VISTA LIMITED,SELENITE 18001S,HKGMNL18C104,HK,47.00,GLUE,"4,111.91",229879.00
6-Dec,PAREF SOUTHRIDGE SCHOOL INC,ACT GLOBAL SPORTS B V,NYK IBIS V012E,N851079528,NL,100.00,GLUE BI COMPONENT POLYURETHANE ADHESIVE,"9,459.67",502836.00
