DATE,IMPORTER,EXPORTER,VESSEL,BL,ORIGIN,QUANTITY,DESCRIPTION,AMOUNT $(CIF), L. COST (PhP) 
12-Dec,STT PHILIPPINES INC,STT INC.,OOCL GUANGZHOU 104S,YOKAFG42841,JP,9072.00,GLUE SE6750A/B,"135,238.12",7343378.00
21-Dec,MARSHTOMP TRADING,"PUNING JUN HAO YU TRADING CO.,",SINOTRANS TIANJIN 1844S,SNL8XMPL007561,CN,3337.00,"GLUE, GLUESTICKS","4,089.63",219300.00
19-Dec,PTC COMMERCIAL CORPORATION,WALTON K.K. INTERNATIONAL,ULTIMA V.18006N,7.73E+11,CN,17496.00,GRASS JELLY 540GX24TINS GOLDEN VALLEY BRAND,"8,712.00",470303.00
18-Dec,BRENNTAG INGREDIENTS INC.,DUPONT NUTRITION BIOSCIENCES,MANCHESTER MAERSK V 844E,606159050,DK,720.00,GRINDAMYL XV,"10,418.26",571370.00
19-Dec,JEIKA PROPERTIES CORP,EXCELLENT GROUP INTERNATIONAL LIMIT,COSCO HAIFA,TAOCB18009725,CN,19250.00,GYPSUM COMPOUND,"4,709.38",259432.00
4-Dec,DESK TOP BAGS PHILIPPINES INC.,GOLDEN COMPANY LIMITED,CALICANTO BRIDGE 268E,PSGNMNL1804454,VN,374.00,HANDBAG ACCESSORIES,"15,540.93",864548.00
20-Dec,TOYOTA TSUSHO PHILS. CORP.,TOYOTSU CHEMIPLAS CORPORATION,IRENES RESPECT V.0007S,ONEYNG8DS3503400,JP,363.00,"HEI-CAST 3035A ,HEI-CAST 3035B","3,340.50",186807.00
3-Dec,ELI LILLY (PHILIPPINES) INC,ELI LILLY AND COMPANY,OOCL BEIJING,6.32E+13,US,18144.00,HEMICELL HT 25KG X1BAG PL,"129,084.12",7008731.00
10-Dec,IMCD PHILIPPINES CORPORATION,SANOVO FOODS A/S,HERMA P V.103E,HDMUHBWB0491110,DK,15000.00,HEN EGG ALBUMEN POWDER,"96,957.00",5262593.00
5-Dec,BOSTIK PHILIPPINES INC.,JIANGSU BOSTIK ADHESIVE CO. LTD,WAN HAI 305 S257,1308503444,CN,2000.00,HERBERTS 1K-LF190-X3,"9,795.22",520224.00
5-Dec,HANKYU HANSHIN LOGISTICS PHILS INC.,"ITATSU CO., LTD",NYK SILVIA 0504S,MEI1183070,JP,339.00,HERME SEAL,"4,781.16",264451.00
18-Dec,HILTI PHILIPPINES INC.,HILTI AKTIENGESELLSCHAFT,EVER GOLDEN/ACX CRYSTAL,OOLU2610777380,SG,9283.00,HILTI FIXING EQUIPMENT FS JOINT FILLER,"25,873.93",1454330.00
12-Dec,HILTI PHILIPPINES INC.,HILTI CORPORATION,MP THE LAW 848W,SGSIN0000097781,SG,4784.00,HILTI FIXING EQUIPMENT INJECTABLE MORTAR,"46,652.01",2587953.00
13-Dec,HILTI PHILIPPINES INC.,HILTI CORPORATION,ACX CRYSTAL 188N,OOLU2613155860,SG,8611.00,HILTI FIXING EQUIPMENT INJECTABLE MROTAR,"44,972.92",2509487.00
6-Dec,BRENNTAG INGREDIENTS INC.,NOVOZYMES A S,KATHARINA SCHEPERS V 221,CPH31115359,DK,10800.00,HITECZYME ENZYME,"131,928.48",7159544.00
11-Dec,H B FULLER PHILS INC,H. B. FULLER (NANJING) CHEMICAL CO,MARIA SCHULTE 0XA1HS,JLS201811142,CN,1000.00,HL9597/1 (HOT MELT MOISTURE CURE ADHESIVE),"7,712.60",411741.00
20-Dec,AKAGI GOMU PHILS. CORP.,"AKAGI CO., LTD",IRENES RESPECT 0007S,YLKS8075940,JP,2093.00,HOT MELT,"16,795.18",935445.00
18-Dec,CASES INTERNATIONAL PHILS INC,"HANGZHOU KAIMIKU IMP&EXP. CO., LTD",ROTTERDAM BRIDGE 002S,SM18E014563,CN,2500.00,HOT MELT ADHESIVE,"4,279.76",243888.00
7-Dec,SIGLO LEATHERWARE MANUFACTURING INC,DONGGUAN ANA INTERNATIONAL FREIGHT,TRF KAYA V. 18004S,7.22E+12,CN,364.00,HOT MELT ADHESIVE,"4,074.01",225724.00
6-Dec,CONSOLIDATED ADHESIVES INC,ADTEK CONSOLIDATED SDN BHD,EVER BONNY 008N,SNKO160181000357,MY,17000.00,HOT MELT ADHESIVE (GLUE),"35,125.20",1860804.00
5-Dec,QUANTA PAPER CORPORATION,FOCUS HOTMELT CO. LTD.,CAPE MAHON,7.13E+11,CN,20160.00,HOT MELT ADHESIVE T100A & T303,"38,524.28",2041585.00
21-Dec,H B FULLER PHILS INC,H.B FULLER (CHINA) ADHESIVES LTD,GSL VALERIE V.0DZ13S1PL,AFZ0106920,CN,9600.00,HOT MELT ADHESIVES D3166 NF ZP,"23,869.44",1277157.00
19-Dec,H B FULLER PHILS INC,H.B FULLER (CHINA) ADHESIVES LTD,SHUN FENG V.228,AFZ0106457,CN,8640.00,HOT MELT ADHESIVES NW-1151ZP,"28,002.24",1566727.00
21-Dec,PROCTER & GAMBLE PHILIPPINES INC.,HENKEL CHEMICAL TECHNOLOGIES(SHANGH,SITC SEMARANG V.1824S,1811007485,CN,8640.00,HOTMELT ADHESIVE,"39,963.19",2236024.00
17-Dec,BOSTIK PHILIPPINES INC.,BOSTIK FINDLEY CHINA CO LTD,ARGOS,CNH0175997,CN,5372.00,HOTMELT H4376/TEP718N (ADHESIVE),"18,588.22",989023.00
10-Dec,H B FULLER PHILS INC,H.B FULLER ADHESIVE MALAYSIA SDN BH,CMA CGM V.01L0SE1PL,PKGMNL18110002,MY,10500.00,"INDUSTRIAL ADHESIVES (GRIPWELL 1201,GRIPWELL","22,661.92",1203331.00
19-Dec,BULWARK EQUIPMENT PARTSHOUSE INC,"FLOOR CHEM ASIA CO., LTD",GUAYAQUIL BRIDGE 739E,ONEYBKKUF1358900,TH,16020.00,INDUSTRIAL KONCREFLEX  POLURETHANE FLOOR COA,"22,975.56",1226533.00
27-Dec,BARRINGTON CARPETS INC.,INTERFACEFLOR (THAILAND) CO LT,GUAYAQUIL,MNL24292047,TH,1176.00,INTERTAC GLUE,"3,375.15",182939.00
21-Dec,GREENFLOOR INNOVATIONS CORPORATION,FLOOR CHEM ASIA CO LTD,GUAYAQUIL BRIDGE 750E,ONEYBKKUF7686500,TH,123550.00,INUSTRIAL POLYURETHANE FLOOR COATING TUFF KR,"178,999.76",9518460.00
10-Dec,COMMODITY QUEST INC.,"DEZHOU RUIKANG BIO TECHNOLOGY CO.,L",KMTC JEBEL ALI 1811S,QDNN8110177,CN,100000.00,ISOLATED SOY PROTEIN,"217,240.00",11477764.00
13-Dec,COMMODITY QUEST INC.,"DEZHOU RUIKANG BIO TECHNOLOGY CO.,L",APL ATLANTA 0BY1JS,QDNN8110247,CN,100000.00,ISOLATED SOY PROTEIN,"217,240.00",11543453.00
5-Dec,BOSTIK PHILIPPINES INC.,JIANGSU BOSTIK ADHESIVE CO. LTD,WAN HAI 305 S257,1308503444,CN,3197.00,ISR 70-03 GREY SAUSAGE 600ML,"15,566.46",824384.00
6-Dec,TRENDWAY BUILDERS INC,YANTAI JIALONG NANO INDUSTRY CO LTD,SEASPAN NEW DELHI V 022S,KFYT18B012,CN,1076.00,JIAJIALY WATER BASED HEAT REFLECTIVE COATING,"9,213.74",490552.00
27-Dec,SIKA PHILIPPINES INC.,SIKA LTD,WAN HAI 222,YHMNL04800318JP,JP,1668.00,JOINT SEALANTS (SIKA HYFLEX-160 CONSTRUCTION,"5,872.37",317590.00
21-Dec,BORAL PLASTERBOARD PHILIPPINES INC.,USG BORAL SDN BHD,EVER BEING,EGLV090800249840,MY,41048.00,JOINTING COMPOUND PREMIUM PREMIX 28KG/PAIL,"12,634.28",684653.00
21-Dec,BORAL PLASTERBOARD PHILIPPINES INC.,USG BORAL SDN BHD,EVER BEING,EGLV090800249831,MY,41048.00,JOINTING COMPOUND PREMIUM PREMIX 28KG/PAIL,"12,634.28",684653.00
21-Dec,BORAL PLASTERBOARD PHILIPPINES INC.,USG BORAL SDN BHD,EVER BEING,EGLV090800252344,MY,41048.00,JOINTING COMPOUND PREMIUM PREMIX 28KG/PAIL,"12,634.28",684653.00
28-Dec,HOUSE TECHNOLOGY INDUSTRIES PTE.LTD,KLEBCHEMIE MG BECKER,CALICANTO BRIDGE 0269N,ONEYHAMU79735900,NL,13200.00,KLEIBERIT PUR 502.8 METAL DRUM WITH INLINER,"59,820.24",3342119.00
12-Dec,BULWARK EQUIPMENT PARTSHOUSE INC,"FLOOR CHEM ASIA CO., LTD",EVER BRAVE 0852,EGLV050801081323,TH,42040.00,KONCREFLEX FLOOR COATING MD/HD CREAM/GREEN,"48,779.12",2587190.00
18-Dec,DKSH PHILIPPINES INC.,SMS CORPORATION CO LTD,SINOTRANS KAOHSIUNG V.024N,BKKCB18016872,TH,30000.00,"KREATION MB,KREATION 20CL,SAUCETEC 637,CRISP","25,274.32",1343950.00
6-Dec,MULTIFLEX RNC PHILS. INC.,CHAN SIEH ENTERPRISES CO LTD,HAI FENG LIAN XING V. 1846N,WTPKELMNL180158,TW,45000.00,LAMINATION GLUE,"46,764.00",2647702.00
21-Dec,NAN PAO RESINS CHEMICAL PHILIPPINES,NAN PAO RESINS CHEMICAL CO   LTD,SINGAPORE 054S,0018D49470,TW,3150.00,LIQUID ADHESIVES T PR5007,"3,339.00",187329.00
21-Dec,NAN PAO RESINS CHEMICAL PHILIPPINES,NAN PAO RESINS CHEMICAL CO   LTD,SINGAPORE 054S,0018D49470,TW,6000.00,LIQUID ADHESIVES T PR5007H,"6,820.00",381421.00
21-Dec,NAN PAO RESINS CHEMICAL PHILIPPINES,NAN PAO RESINS CHEMICAL CO   LTD,SINGAPORE 054S,0018D49470,TW,2000.00,LIQUID ADHESIVES T UR049H,"7,240.00",404707.00
13-Dec,HONDA PHILIPPINES INC.,THREE BOND SINGAPORE PTE LTD,LOBIVIA V079E,X1812012MNL001,SG,19.00,LIQUID GASKET,"3,890.00",216411.00
28-Dec,MYBRUSH TECHNOLOGY (PHIL.) INC.,MYBRUSH INDUSTRIES SDN BHD,MERKUR HORIZON 850W,MCB635099,MY,2.00,LOCTITE 403,"3,457.44",199355.00
11-Dec,MYBRUSH TECHNOLOGY (PHIL.) INC.,MYTECH & ASSEMBLY SDN BHD,MP THE LAW 848W,MCB635079,MY,6.00,"LOCTITE 403,406","4,144.22",236376.00
5-Dec,HANKYU HANSHIN LOGISTICS PHILS INC.,"ITATSU CO., LTD",NYK SILVIA 0504S,MEI1183070,JP,763.00,LOCTITE 7387 ETC.,"10,753.78",594101.00
5-Dec,DYSON ELECTRONICS PTE LTD PH BRANCH,HENKEL SINGAPORE PTE LTD,LOS ANDES BRIDGE 109N,SG000024062OE,SG,360.00,LOCTITE EA 9492 B EDS CONTROL 17060-22 FEB 2,"32,162.91",1782326.00
7-Dec,HENKEL PHILIPPINES INC.,HENKEL SINGAPORE PTE LTD,ACX CRYSTAL 188N,MNL181206620082,SG,358.00,"LOCTITE FREKOTE 700-NC 1 GA,LOCTITE AA","4,200.98",234867.00
20-Dec,HENKEL PHILIPPINES INC.,HENKEL SINGAPORE PTE LTD,XIN QIN HUANG DAO 048E,MNL181206620266,SG,122.00,"LOCTITE SF 7246 BO500MLEN/CH/JP,LOCTITE","6,608.08",373094.00
5-Dec,HENKEL PHILIPPINES INC.,HENKEL SINGAPORE PTE LTD,EVER BONY 1685-008N,MNL181106620328,SG,192.00,LOCTITE SF 7387 BO1.75OZEN/SP,"4,688.38",261805.00
5-Dec,HYCO LABORATORIES CO.INC.,PANCHEM INTERNATIONAL TRADING AND I,MARIA SCHULTE,QIML6102103WFL2,CN,16000.00,MALTODEXTRIN FOOD GRADE,"10,330.00",554837.00
26-Dec,BASF PHILIPPINES INC,BASF MALAYSIA SDN BHD,EVER BEADY 1688-011N,EGLV091830555424,MY,20075.00,MASTERSEAL 530,"8,982.34",483297.00
4-Dec,BASF PHILIPPINES INC,BASF MALAYSIA SDN BHD,EVER BEING 1686-002N,EGLV091830534524,MY,36936.00,MASTERSEAL 540 PART A MASTERSEAL 540 PART B,"17,535.51",934272.00
6-Dec,BASF PHILIPPINES INC,PT BASF DISTRIBUTION INDONESIA,JACKSON BAY 0QASAN1NC,ARM0156945,ID,14300.00,MASTERSEAL 590 MASTERSEAL 540 PART A PMASTER,"9,443.70",507452.00
4-Dec,JAMES HARDIE PHILIPPINES INC,VIVACITY ENGINEERING PTY LTD,BUXCLIFF,AUSYDAS2105779,AU,815.00,MEGAPOXY P1 20 LITER,"3,642.25",211961.00
20-Dec,LOTUSORB ENTERPRISES,VEDAN (VIETNAM) ENTERPRISE,LORRAINE 18016N,3.42E+11,VN,90000.00,MODIFIED STARCH,"47,217.00",2531171.00
28-Dec,WRIGLEY PHILIPPINES INC,JASOL ASIA PACIFIC LIMITED,NORDPUMA 0XS26N,GTD0426194,TH,12000.00,MODIFIED STARCH,"12,927.12",696310.00
11-Dec,INGREDION PHILIPPINES INC.,NATIONAL STARCH AND CHEMICAL,SITC LIAONING 1839N,ONEYBKKUE2389600,TH,18000.00,MODIFIED STARCH N-DULGE 312,"34,391.40",1820495.00
28-Dec,UNSU CORPORATION,ROQUETTE ITALIA SPA,TALOS 011,APLU709092245,IT,24000.00,MODIFIED STARCH PXG,"43,175.09",2383179.00
10-Dec,UNSU CORPORATION,ROQUETTE ITALIA SPA,CSCL MERCURY 057,APLU709091446,IT,24000.00,MODIFIED STARCH PXG,"43,175.00",2355080.00
19-Dec,UNSU CORPORATION,ROQUETTE ITALIA  SPA,CMA CGM CENTAURUS,AZT0100719,IT,24000.00,MODIFIED STARCH PXG,"43,175.00",2368526.00
18-Dec,NUTRI-ASIA INC.,TATE & LYLE NETHERLANDS B.V,CSCL P OCEAN 029,APLU706178277,NL,19750.00,MODIFIED STARCH WAXY MAIZE RESISTAMYL 345,"16,487.90",910322.00
19-Dec,INGREDION PHILIPPINES INC.,NATIONAL STARCH AND CHEMICAL,GUAYQUIL BRIDGE 750E,ONEYBKKUE8656900,TH,104500.00,MODIFIED STARCH/NATONAL (TAPIOCA) 8991,"103,560.96",5515183.00
26-Dec,MONDE NISSIN CORPORATION,GENERAL STARCH LIMITED,LYDIA 0854-027E,EGLV050801089073,TH,20000.00,MODIFIED TAPIOCA STARCH STARFIRM 18,"15,231.29",818585.00
18-Dec,NUTRI-ASIA INC.,TATE & LYLE NETHERLANDS B.V,CSCL P OCEAN 029,APLU706178278,NL,98750.00,MODIFIED WAXYMAIZE STARCH(Resistamyl),"82,439.50",4526357.00
26-Dec,SAN MIGUEL BREWERY INC,C.T. STRUCKMANN & WAEGE,MOL BREEZE,CGN060008,DE,2100.00,MUNKADUR GL BROWN BASE/HARDENER,"60,986.56",3402952.00
19-Dec,SCAD SERVICES (S) PTE. LTD. - PHIL,HRD SINGAPORE PTE LTD,IRENES RESPECT 0007S,ONEYSM8BB3814600,JP,25585.00,NOTAPE-BOND,"81,945.78",4569337.00
6-Dec,CORNELL INGREDIENTS CORPORATION,ROQUETTE FRERES,SEASPAN THAMES 008E,LIL0019397,FR,1000.00,NUTRIOSE FB 06,"3,716.04",206997.00
19-Dec,INGREDION PHILIPPINES INC.,INGREDION INC. 5 WESTBROOK,YM MODERATION 042W,6.32E+13,US,3606.00,"N-ZORBIT M (NON-GM,P) MODIFIED STARCH","10,330.82",576488.00
6-Dec,OTHMANN INC.,ASUNG CLEAN FLOW TECH CO LTD,GREEN ACE 0150S,ULCMNL1801118,KR,1400.00,OATEY SOLVENT CEMENT,"24,714.08",1371647.00
4-Dec,DPO  PHILIPPINES  INC,BENEO ORAFTI S.A,LOS ANDES BRIDGE 111W,ONEYANRU22925700,BE,21000.00,ORAFTI GR BAG 25KG,"50,748.39",2765728.00
5-Dec,DPO  PHILIPPINES  INC,BENEO ORAFTI S.A,LOAB111W,ONEYANRU22954901,BE,21000.00,ORAFTI GR BAG 25KG,"50,748.39",2765728.00
5-Dec,DPO  PHILIPPINES  INC,BENEO ORAFTI S.A,LOS ANDES BRIDGE 111W,ONEYANRU22954902,BE,21000.00,ORAFTI GR BAG 25KG,"50,748.39",2765728.00
6-Dec,LEADER ELECTRONICS PHILIPPINE,SOMEWIN IMPORT AND EXPORT TRADING C,CMA CGM PELLEAS V01S0VW,WD1801670,CN,1600.00,PADDING,"10,497.49",581288.00
13-Dec,UNIFIBER MULTISALES CORPORATION,"XIAMEN BEHR TRADE CO., LTD.",TRF KAYA 18004S,7.22E+11,CN,42500.00,PAPER TUBE GLUE,"14,007.02",749994.00
19-Dec,WIN FORMULA INC,"CONNWAY CO., LTD.",EVER BREED 0859-002W,KELMNL1812025,TW,1065.00,"PASTE-CLEAR 553, 10005PFX EPIC SPECIAL EFFEC","13,231.49",735805.00
6-Dec,TOYOTA TSUSHO PHILS. CORP.,TOYOTSU CHEMIPLAS CORPORATION,SITC HEBEI V.1820S,SITNGMN18225101,JP,2507.00,PLASTIC RESIN (S440),"18,405.01",1019561.00
3-Dec,WU KONG SINGAPORE PTE. LTD. PHIL.,NEDEX CHEMIE DEUTSCHLAND GMBH,MP THE BROWN 847W,966447916,NL,16056.00,POLYSULFIDE COMPONENT,"56,048.49",3196343.00
18-Dec,WU KONG SINGAPORE PTE. LTD. PHIL.,NEDEX CHEMIE DEUTSCHLAND GMBH,BALTHASAR SCHULTE 849W,966607813,DE,16733.00,POLYSULFIDE COMPONENT A (PS-99R COMP.A,"60,163.81",3353471.00
12-Dec,DAFFID INDUSTRIES INCORPORATED,TRISIGMA GLORY VENTURES PTE LT,MP THE LAW,KNGMNL1812001,CN,2560.00,POLYURETHANE ADHESIVE,"15,497.10",817406.00
12-Dec,DAFFID INDUSTRIES INCORPORATED,TRISIGMA GLORY VENTURES PTE LT,MP THE LAW,KNGMNL1812001,CN,1280.00,POLYURETHANE ADHESIVE,"11,163.17",589473.00
12-Dec,DAFFID INDUSTRIES INCORPORATED,TRISIGMA GLORY VENTURES PTE LT,MP THE LAW,KNGMNL1812001,CN,432.00,POLYURETHANE ADHESIVE,"3,767.57",200525.00
10-Dec,BRENNTAG INGREDIENTS INC.,DUPONT NUTRITION BIOSCIENCES,MONACO MAERSK V 842E,606132559,DK,3080.00,"POWERBAKE 950,GRINDAMYL XV","40,287.18",2188535.00
28-Dec,K2RJL INDUSTRIAL SALES AND SERVICES,POXYTECH,YM EXCELLENCE 028E,SCZA00023984,ZA,680.00,POXYPASTE BBS101 RESIN AND HARDENER,"5,235.00",298783.00
19-Dec,FOOD INDUSTRIES INC.,ROQUETTE ITALIA SPA,CMA CGM CENTAURUS,AZT0100711,IT,18000.00,"PREGEFLO CH10, BATCHES S0065","32,746.63",1795196.00
6-Dec,PURATOS PHILIPPINES INC.,PURATOS NV,YM WORTH V. 016E,ONEYANRU22344900,BE,300.00,PREMIX B-15032,"5,354.66",291767.00
27-Dec,PURATOS PHILIPPINES INC.,PURATOS NV,SEASPAN HUDSON 009E,ONEYANRU25298600,BE,320.00,"PREMIX X-220,  PREMIX X-870","6,735.42",372223.00
3-Dec,CONNELL BROS. COMPANY PILIPINAS INC,DMV FONTERRA EXCIPIENTS,TRITON V 013E,OOLU2104120090,NL,1350.00,PRIMOJEL SODIUM STARCH GLYCOLATE,"5,400.00",295923.00
3-Dec,ALTERNATIVES FOOD CORP,SCANFLAVOUR A/S,TITAN,EBJ31108697,DK,44000.00,PROTEIN SUBSTANCE (SCANGEL B-100),"37,904.00",2046294.00
3-Dec,ALTERNATIVES FOOD CORP,SCANFLAVOUR A/S,TITAN,EBJ31108579,DK,44000.00,"PROTEIN SUBSTANCE (SCANPREMIUM D-85, SCANGEL","37,904.00",2046294.00
4-Dec,INGREDION PHILIPPINES INC.,NATIONAL STARCH AND CHEMICAL,CALICANTO BRIDGE 268E,ONEYBKKUD9313600,TH,82608.00,PURITY 77 HV/N-DULDGE 312/H50/PURITY GUM 40/,"107,346.64",5668812.00
3-Dec,MAKATI DEVELOPMENT CORPORATION,VANJOIN GROUP,MATTINA V.0KR3HS1NC,NKG0009708,CN,18000.00,PUTTY POWDER,"3,012.34",166453.00
21-Dec,FURUKAWA SANGYO KAISHA PHILIPPINES,NISHI TOKYO CHEMIX CORPORATION,IRENES RESPECT 0007S,KLLMJP1054238,VN,254.00,"QR-3460 (ADHESIVE), THREEBOND 3006F","17,961.32",998858.00
28-Dec,KK CONVERTER PHILS INC.,KUO TAI RESIN INDUSTRIAL CO LTD,SINGAPORE V 054N,0018D53946,TW,18000.00,RAW MATERIALS FOR MANUFACTURING  PRESSURE SE,"7,898.00",452002.00
28-Dec,KK CONVERTER PHILS INC.,KUO TAI RESIN INDUSTRIAL CO LTD,SINGAPORE V 054N,0018D43117,TW,36000.00,RAW MATERIALS FOR MANUFACTURING PRESSURE SEN,"15,796.00",898438.00
12-Dec,KK CONVERTER PHILS INC.,KUO TAI RESIN INDUSTRIAL CO LTD,SINGAPORE S053,0018D03497,TW,36000.00,RAW MATERIALS FOR MANUFACTURING PRESSURE SEN,"14,400.00",810851.00
28-Dec,KK CONVERTER PHILS INC.,KUO TAI RESIN INDUSTRIAL CO LTD,SINGAPORE V 054N,0018D48579,TW,15840.00,RAW MATERIALS FOR MANUFACTURING PRESSURE SEN,"11,941.52",677961.00
19-Dec,CONNELL BROS. COMPANY PILIPINAS INC,ANHUI WANWEI INTERNATIONAL TRADE,DE JIN 8 18092,EGLV145899121353,CN,13000.00,RE-DISPERSIBLE EMULSION POWDER,"22,857.00",1220505.00
4-Dec,DPO  PHILIPPINES  INC,BENEO-REMY NV,SING051N,N851082031,BE,8250.00,REMY GEL 663,"17,610.80",964440.00
26-Dec,NUTRI-ASIA INC.,TATE & LYLE NETHERLANDS B.V,MUNKEBO MAERSK,966931940,NL,118500.00,RESISTAMYL 345 MODIFIED WAXYMAIZE STARCH,"98,927.00",5443521.00
6-Dec,DSM NUTRITIONAL PRODUCTS PHILIPPINE,DSM Nutritional Products Asia,LOBIVIA 078E,SINCB18040946,SG,4000.00,RONOZYME HIPHOS GT,"64,466.17",3497226.00
6-Dec,UNIVERSAL ROBINA CORPORATION,DSM NUTRITIONAL PRODUCTS LTD.,NYK VEGA V.061E,ONEYRTMU29446600,DE,20000.00,RONOZYME WX (CT),"147,727.25",8015818.00
19-Dec,ANGELES CORE ENTERPRISES INC,ADISSEO ASIA PACIFIC PTE LTD,CMA CGM VERDI,SEMNL181104008,FR,1000.00,ROVABIO ADVANCE T-FLEX,"44,057.06",2410563.00
5-Dec,HANKYU HANSHIN LOGISTICS PHILS INC.,"ITATSU CO., LTD",NYK SILVIA 0504S,MEI1183070,JP,516.00,RQ-NSE ETC.,"7,271.60",401907.00
14-Dec,PRINCEACE CORP.,"THE YOKOHAMA RUBBER CO.,",NASIA,YOKMNL18115201,JP,46.00,"RUBBER CEMENT C-41/42,","3,707.60",207767.00
17-Dec,TOYOTA TSUSHO PHILS. CORP.,TOYOTSU CHEMIPLAS CORPORATION,IRENES RESPECT V.0007S,ONEYNG8DS3503402,JP,1350.00,S440 (PLASTIC RESIN),"12,270.00",692515.00
18-Dec,EDWARD KELLER (PHILS.) INC.,SMS CORPORATION CO LTD,SITC LIAONING V.1837N,1MNL18110239,TH,6000.00,"SAUCETEC 637, KREATION TU10, KREATION 1202","6,885.00",368921.00
19-Dec,LUCKY KNIGHT TRADING,HUIZHOU KAINI INDUSTRIAL,NAVIOS AMARANTH 1823S,SNL8NBPLA461373,CN,3199.00,SCHOOL SUPPLIES (GLUE),"4,144.67",221707.00
27-Dec,PILIPINAS KYOHRITSU INC.,SUMITOMO WIRING SYSTEMS LTD,NYK SILVIA V0505S,JPPHTYO03347,JP,727.00,SEALANT,"18,782.62",1047436.00
18-Dec,PILIPINAS KYOHRITSU INC.,SUMITOMO WIRING SYSTEMS LTD,IRENE RESPECT V0007S,JPPHTYO03342,JP,336.00,SEALANT,"8,685.59",484351.00
18-Dec,PILIPINAS KYOHRITSU INC.,SUMITOMO WIRING SYSTEMS LTD,IRENE RESPECT V0007S,JPPHTYO03341,JP,286.00,SEALANT,"7,382.76",412974.00
28-Dec,TAIHAN PRECISION TECHNOLOGY (PHILIP,ZHEJIANG GANGLIU POLYMER TECH,SITC SEMARANG V 1824S,318557588,CN,200.00,SEALANT,"7,221.34",421971.00
17-Dec,SUMI PHILIPPINES WIRING SYSTEMS,SUMITOMO WIRING SYSTEMS LTD,IRENES RESPECT 0007S,ONEYNG8BC1659500,JP,173.00,SEALANT,"4,994.22",279417.00
11-Dec,PILIPINAS KYOHRITSU INC.,SUMITOMO WIRING SYSTEMS LTD,NASIA V180S,JPPHTYO03334,JP,189.00,SEALANT,"4,879.89",272465.00
4-Dec,SUMI PHILIPPINES WIRING SYSTEMS,SUMITOMO WIRING SYSTEMS LTD,NYK SILVIA 0504S,ONEYNG8BC1237400,JP,156.00,SEALANT,"4,012.35",223005.00
11-Dec,JANGHO GROUP CO LTD PHILIPPINE BRAN,TWO NINE SIX O TRADING PTE.LTD,LOS ANDES BRIDGE V109N,SE1811004001,SG,816.00,SERIES AS 205 ELASTOMERIC SPRAY PALE BLUE,"6,066.82",341124.00
12-Dec,EXQUADRA INC.,TWO NINE SIX O TRADING PTE.LTD,ACX CRYSTAL,HDMUSGWB0554767,SG,3391.00,"SERIES AS205 ELASTOMERIC SPRAY PALE BLUE,","25,237.39",1405121.00
12-Dec,SIKA PHILIPPINES INC.,SIKA LTD,WAN  HAI 310 S007,4.21E+13,JP,4472.00,SIKAFLEX 255 EXTRA BLACK,"28,310.87",1500255.00
4-Dec,KDTECHNOLOGIES INC.,KYOEI DENKI SINGAPORE PTE LTD,LOS ANDES BRIDGE 109N,SIN0739347,SG,1275.00,SILICONE COMPOUND-CONTROLLED,"19,500.00",1079615.00
14-Dec,ACBEL POLYTECH PHILIPPINES INC.,"SOONEST EXPRESS(H.K)CO.,LTD",TRF KAYA 18004S,HKGMNL18C001,HK,7868.00,SILICONE GLUE,"41,103.24",2273094.00
19-Dec,SIKA PHILIPPINES INC.,SIKA ENGINEERING SILICONES SRL,CMA CGM MUSCA 0ME1QE1MA,OOLU4046923860,IT,12880.00,SILICONE SEALANT,"51,357.99",2864193.00
12-Dec,HARDWARE & INDUSTRIAL SOLUTIONS INC,HANGZHOU XIAORAN IMPORT &,COSCO HAIFA V. 050S,COAU7057083560A,CN,810.00,SILICONE SEALANT,"5,474.93",294115.00
3-Dec,DIAMOND DRY MORTAR INC.,kg mix sdn bhd,EVER BEING,ICLMNL1811019,MY,14000.00,SKIMCOAT- DIAMOND FINISH WHITE/,"4,710.55",253492.00
20-Dec,ALYSONS' CHEMICAL ENTERPRISES INC,USG BORAL SPECIALTY PRODUCTS,CSCL EAST CHINA SEA,COSU8019937640,US,13605.00,SNOW WHITE FILLER F&P 50 PPR,"9,015.69",512424.00
6-Dec,SBS PHILIPPINES CORPORATION,LONGCOM ENTERPRISE LTD.,CASTOR N,AHHY021061,CN,12000.00,SODIUM CASEINATE 90-120MESH,"82,800.00",4365481.00
17-Dec,HYCO LABORATORIES CO.INC.,PANCHEM INTERNATIONAL TRADING AND I,APL ATLANTA,FLQDNR4GB8000200B,CN,11720.00,SOY PROTEIN ISOLATE FOOD GRADE,"32,278.00",1721104.00
3-Dec,FRABELLE CORPORATION,"QINGDAO CPI INTERNATIONAL CO.,",SEASPAN NEW DELHI V022S,COAU7042466050,CN,22000.00,SOY PROTEIN ISOLATED PUREPRO 90E,"52,360.00",2774522.00
6-Dec,FRABELLE CORPORATION,"QINGDAO CPI INTERNATIONAL CO.,",MARIA SCHULTE V0XA1HS,AAGA014090,CN,22000.00,SOY PROTEIN ISOLATED PUREPRO 90E,"52,360.00",2773998.00
7-Dec,FRABELLE CORPORATION,"QINGDAO CPI INTERNATIONAL CO.,",MARIA SCHULTE V0XA1HS,AAGA014108,CN,22000.00,SOY PROTEIN ISOLATED PUREPRO 90E,"52,360.00",2773998.00
12-Dec,FRABELLE CORPORATION,"QINGDAO CPI INTERNATIONAL CO.,",ALDI WAVE V745S,GOSUQIN3775077,CN,22000.00,SOY PROTEIN ISOLATED PUREPRO 90E,"51,260.00",2717054.00
21-Dec,FRABELLE CORPORATION,"QINGDAO CPI INTERNATIONAL CO.,",MAERSK JAIPUR V1S,GOSUQIN3775082,CN,22000.00,SOY PROTEIN ISOLATED PUREPRO 90E,"51,260.00",2739202.00
5-Dec,JEBSEN & JESSEN INGREDIENTS (P),DANISCO SINGAPORE PTE LTD,MP THE BROWN V.847W,MCB633142,CN,7168.00,SPEZYME (R) POWERLIQ LIQUID AMYLASE BLEND,"34,415.38",1874944.00
10-Dec,FREY-FIL CORPORATION,SPLICE SLEEVE (S) PTE LTD.,MP THE BROWN V.847W,TSE8B008801,MY,3877.00,SS MORTAR GROUT,"15,405.60",813523.00
18-Dec,CARGILL TEXTURIZING SOLUTIONS,CARGILL INCORPORATED,IRENES RESPECT V. 0007N,ONEYRICUW9594500,US,31752.00,STABITEX-INSTANT 12624 MOD STARCH,"45,087.04",2473071.00
13-Dec,GETZ BROS PHILIPPINES INC,CONVATEC INTERNATIONAL SERVICES GMB,LOBIVIA V. 079E,AGIMNL1812006,SG,44.00,STOMAHESIVE  PASTE,"3,132.33",178587.00
12-Dec,BRENNTAG INGREDIENTS INC.,ROQUETTE FRERES,SEASPAN AMAZON V 008E,HLCUDKK180903471,FR,30000.00,TACKIDEX I 231,"60,540.35",3296297.00
18-Dec,HENKEL PHILIPPINES INC.,HENKEL CHEMICAL TECHNOLOGIES,INFINITY 1817S,SHA536723,CN,7350.00,TECHNOMELT 3183 25KG,"16,544.56",883080.00
7-Dec,HENKEL PHILIPPINES INC.,HENKEL ADHESIVES TECHNOLOGIES,SCIO SKY VOY 846W,SHA532877,CN,7000.00,TECHNOMELT 3183 25KG,"16,004.92",853123.00
12-Dec,HENKEL PHILIPPINES INC.,BENORE LOGISTICS FOR HENKEL US,APL COLUMBUS 308W,HOU029200,US,896.00,TECHNOMELT DM 519A BLUE,"8,629.41",482644.00
11-Dec,HENKEL PHILIPPINES INC.,BENORE LOGISTICS FOR HENKEL US,APL COLUMBUS 308W,HOU029203,US,899.00,TECHNOMELT DM 519A BLUE,"8,350.20",467222.00
18-Dec,HENKEL PHILIPPINES INC.,HENKEL CHEMICAL TECHNOLOGIES,HEUNG A GREEN 0147S,SHA534745,CN,4000.00,TECHNOMELT EASY-PAC 100 25KG,"13,479.18",720007.00
20-Dec,HENKEL PHILIPPINES INC.,HENKEL CHEMICAL TECHNOLOGIES,MAERSK JAIPUR 848W,SHA537215,CN,11650.00,"TECHNOMELT EASY-PAC 100 25KG, TECHNOMELT 318","34,055.76",1818867.00
4-Dec,INGREDION PHILIPPINES INC.,INGREDION INC. 5 WESTBROOK,YM MOVEMENT 040W,6.32E+13,US,18371.00,THERMEX (TRUETRACE IP),"20,842.32",1145885.00
18-Dec,INGREDION PHILIPPINES INC.,INGREDION INC. 5 WESTBROOK,MOL PARTNER 108W,6.32E+13,US,18371.00,THERMEX MODIFIED STARCH,"21,160.40",1170119.00
18-Dec,INGREDION PHILIPPINES INC.,INGREDION INC. 5 WESTBROOK,MOL PARTNER 108W,6.32E+13,US,18348.00,THERMEX MODIFIED STARCH,"21,137.54",1168873.00
13-Dec,INGREDION PHILIPPINES INC.,INGREDION INC. 5 WESTBROOK,YM MODERATION 042W,6.32E+13,US,18371.00,THERMEX MODIFIED STARCH,"20,842.32",1146292.00
5-Dec,RNRS TRADING,GAMRON INDUSTRIES SDN BHD,EVER BEING 002N,SNKO160181100280,MY,25000.00,THERMOPLASTIC ROAD MARKING MATERIALS,"17,830.40",948601.00
5-Dec,INGREDION PHILIPPINES INC.,INGREDION INCORPORATED,NYK ATLAS V104W,6.32E+13,US,18371.00,THERMTEX TRUETRACE IP,"20,842.32",1144555.00
6-Dec,BASF PHILIPPINES INC,BASF VIETNAM CO LTD,AMALIA C 051B,1.10E+11,VN,17280.00,UCRETE PT3  MF,"8,837.04",475620.00
17-Dec,OCTOEIGHT CHEMICAL CORPORATION,PHYTOZYMES ENTERPRISES INDIA,OLIVIA 115S,281387380MAA,IN,4000.00,ULTRA REFINED PAPAIN LS-ENZYME,"17,940.00",989972.00
20-Dec,ESICOR INCORPORATED,VANDEX INTERNATIONAL LTD.,TOKYO TRIUMPH V. 1001008E,THAM4131976,DE,22000.00,VANDEX SUPER,"19,195.55",1081381.00
5-Dec,RESOURCE ONE CORPORATION,"VITROCHEM TECHNOLOGY PTE., LTD",CMA CGM VERDI V.0IL0SE1PL,GALSE181109501,SG,48.00,VITROBOND PP PRIMER 2100,"6,912.00",402892.00
21-Dec,WALL VISION CORPORATION,SILMATE SILICONE CO. LTD,SELENITE 18001S,7.22E+11,CN,23810.00,WALL 'N SIL 10 SILICONE SEALANT,"80,062.00",4227986.00
11-Dec,SUPERL PHILIPPINES INC,DONGGUAN ANA INTERNATIONAL FREIGHT,TRF KAYA V. 18004S,7.22E+12,CN,35.00,WATER BASED ADHESIVE,"7,535.90",416435.00
17-Dec,SUPERL PHILIPPINES INC,SUPERL HOLDINGS LTD,SELENITE V. 18001S,ELCKHKG18120032,HK,1264.00,WATER BASED ADHESIVE,"7,532.08",419879.00
7-Dec,ANGELES ALLIANCE LEATHERWARE INC.,SUPERL HOLDINGS LTD.,TRF KAYA V. 18004S,ELCKHKG18110143,HK,575.00,WATER BASED ADHESIVE,"4,590.52",254704.00
21-Dec,SIGLO LEATHERWARE MANUFACTURING INC,SUPERL HOLDINGS LTD,URU BHUM 18004S,ELCKHKG18120067,HK,564.00,WATER BASED ADHESIVE,"3,342.15",187625.00
4-Dec,SIGLO LEATHERWARE MANUFACTURING INC,SUPERL HOLDINGS LTD,CAPE MAHON V. 18012S,ELCKHKG18110101,HK,564.00,WATER BASED ADHESIVE,"3,334.23",185241.00
17-Dec,SIGLO LEATHERWARE MANUFACTURING INC,SUPERL HOLDINGS LTD,SELENITE V. 18001S,ELCKHKG18120030,HK,11.00,WATER BASED ADHESIVE,"3,332.37",186328.00
6-Dec,PERPETUAL PRIME MFG. INC.,BASIC ADHESIVES GROUP,TRF KAYA 18004S,1.84E+11,HK,940.00,WATER BASED ADHESIVES (NON HAZARDOUS),"5,593.95",314838.00
4-Dec,SAVE EARTH TECHNOLOGIES AND SERVICE,ENVIRO-ZYME LLC,HYUNDAI BANGKOK V.081W,DETMAN1845002,US,1796.00,WATER TREATMENT COMPOUNDS ENZYMES,"26,727.76",1454339.00
17-Dec,GRAND ARRAIER TRADING,NUKOTE COATING SYSTEMS INT'L,HENRY HUDSON BRIDGE 0,326011985,US,8220.00,WATERPROOFING MATERIAL,"18,134.00",1018523.00
11-Dec,BOSTIK PHILIPPINES INC.,POLYCOAT PRODUCTS,APLESPLANADE 0TX1AW1MA,453023,US,57552.00,WATERPROOFING MATERIALS (BOSCOSEAL PU),"146,558.09",8116373.00
11-Dec,POLARA CHEMICAL CORP.,CHEMIX GURU LTD,CORDELLIA 0856 009W,EGLV003803215571,TW,18240.00,WHITE GLUE,"19,745.42",1097702.00
18-Dec,PILIPINAS KYOHRITSU INC.,SUMITOMO WIRING SYSTEMS LTD,IRENE RESPECT V0007S,JPPHTYO03342,JP,133.00,WIRING HARNESS COMPONENTS ( BOND),"3,439.16",193169.00
27-Dec,EDGE SOFT GOOD SOLUTIONS INC.,DONG IN ENTECH CO LTD,NYK SILVIA 0505S,ANEX1812025,KR,951.00,WPSI 01,"3,137.48",173760.00
19-Dec,CHAIN GLASS ENTERPRISES INC.,DOW EUROPE GMBH,SQ910,7TW9101,BE,2374.00,DOWSIL 896 PANELFIX BLACK,"25,243.94",1410338.00
19-Dec,ASIA PRIMERA KIMIKA INC.,IKEDA CORPORATION,FX5158,8.10E+11,JP,20.00,1 PKG STC SILKALL 100 COSMETIC RAW MATERIAL,"3,582.56",197025.00
20-Dec,STMICROELECTRONICS INC.,HENKEL US OPERATIONS CORPORATION,BR271,3.40E+11,US,76.00,"1.00 EA LOCTITE ABLESTIK 5025E-003, ETC","15,873.21",886605.00
17-Dec,BANNER PLASTICARD INC.,MUEHLBAUER GMBH & CO. KG,TK084,MUC14006176,JP,71.00,110 PCS CHIP MODULE ADHESIVE,"6,299.69",355777.00
