DATE,IMPORTER,EXPORTER,VESSEL,BL,ORIGIN,QUANTITY,DESCRIPTION,AMOUNT $(CIF), L. COST (PhP) 
20-Mar,SAN MIGUEL FOODS INC,GLOBAL NUTRITION ASIA-PACIFIC,MSC DANIT V.806E,HDMUAWML0904484,FR,4320.00,"SAFIZYM GP60"" BRAND GLUCANASE",243557.49,13469286.00
2-Mar,S.D. TRADING CORPORATION,SUNSTAR CHEMICAL (THAILAND) CO,ITAL MASSIMA,EGLV050800112381,TH,23760.00,"SUNSTAR BRAND"" SEALING COMPOUND""""SUNSTAR BRAND"" SEALING COMPOUND""""UNSTAR BRAND"" SEA""""NSTA""","17,067.48",950052.00
1-Mar,HENKEL PHILIPPINES INC.,PT.HENKEL ADHESIVE TECHNOLOGIE,SONGA HAYDN 804A,10024,ID,29315.00,"1X20 & 1X40 CTR STC TECHNOMELT 2304 WV,MELTA","73,269.16",3852724.00
13-Mar,CHEMICAL RESEARCH PRODUCTS,PRO TECH USA LC,MSC LEIGH / 9S,SES000003473,US,6741.00,"1X20 CNTR 7 PLTS STC: MAGNA ZYME DEX, MAGNA","64,180.00",3447612.00
21-Mar,MONDE NISSIN CORPORATION,GENERAL STARCH LIMITED,MOL HORIZON 1101E,BKKCB18001548,TH,19000.00,1X20 CONT MODIFIED TAPIOCA STARCH,"13,652.21",721768.00
1-Mar,MAXION BIOSCIENCE INC.,DANISCO SINGAPORE PTE LTD,NORTHERN DIAMOND,MCB161153,SG,7675.00,1X20 CONT STC AXTRA XAP 101 TPT AXTRA PHY 10,"72,344.57",3901627.00
19-Mar,MONDE NISSIN CORPORATION,GENERAL STARCH LIMITED,MOL HOPE 0042E,BKKCB18001116,TH,19000.00,1X20 CONT STC MODIFIED TAPIOCA STARCH,"13,652.23",721769.00
13-Mar,HAMBURG TRADING CORPORATION,CARGILL DEUTSCHLAND GMBH,SOFIA EXPRESS V.044E,NYKSHAMU00721700,DE,16225.00,1X20 CONTAINER STC: 679 BAGS C TEX 06205 ACE,"16,744.84",907035.00
14-Mar,HAMBURG TRADING CORPORATION,CARGILL BIO CHEMICAL CO LTD,MARIA SCHULTE,XDFF301914,CN,19750.00,1X20 CONTAINER STC: 790 BAGS DISTARCH PHOSPH,"20,519.11",1077303.00
15-Mar,HAMBURG TRADING CORPORATION,K.D FEDDERSEN,MILLAU BRIDGE V. 015E,NYKSBCNU00730500,ES,5460.00,1X20 CONTAINER STC: 8 PALLETS GLUES AND ADHE,"14,675.98",811454.00
14-Mar,HAMBURG TRADING CORPORATION,CARGILL BIO CHEMICAL CO LTD,MARIA SCHULTE,XDFF301913,CN,19750.00,1X20 CONTAINER STC: DISTARCH PHOSPHATE C STA,"15,159.94",798676.00
9-Mar,SAGAWA GLOBAL LOGISTICS PHILIPPINES,MACDERMID PERFORMANCE SOLUTION,NORTHERN VALENCE V. 8-046N,SEATF1803001401,SG,5623.00,1X20 CTNR 6 PLTS STC: ULTRA ETCH FINE LINE M,"6,782.54",374310.00
20-Mar,HENKEL PHILIPPINES INC.,PT HENKEL ADHESIVE TECHNOLOGIE,NAVIOUS AMARILLO,10003,ID,11500.00,1X20 CTR STC TECHNOMELT 2202 WV ADHESIVES,"24,182.66",1268137.00
14-Mar,HENKEL PHILIPPINES INC.,PT HENKEL ADHESIVE TECHNOLOGIE,GH LESTE 804A,10042,ID,7825.00,1X20 CTR STC TECHNOMELT SUPRA 100 ADHESIVE,"24,174.00",1267687.00
27-Mar,HENKEL PHILIPPINES INC.,PT.HENKEL ADHESIVE TECHNOLOGIE,CPO NORFOLK,10012,ID,5425.00,"1X20 CTR STC TECHNOMELT SUPRA 100,TECHNOMELT","16,787.88",886802.00
13-Mar,DEL MONTE PHILS INC. / PHILPACK,CARGILL DEUTSCHLAND GMBH,SOFIA EXPRESS 044E,NYKSHAMT70411200,BE,18000.00,1X20 STC 720 BAGS C TEX 06214 ACETYLATED DIS,"16,677.60",904021.00
14-Mar,REPUBLIC CHEMICAL INDUSTRIES INC.,AKKIM YAPI KIMYASALLARI SAN VE TIC,YM WINDOW,M594047781,TR,7431.00,1X20 STC FLEXOSEAL PU SEALANT SAUSAGE 600ml,"27,090.22",1489638.00
1-Mar,SHINDENGEN PHILIPPINES CORPORATION,PANASONIC MANUFACTURING AYUTHAYA CO,MONACO V. 0038N,MOLU13807447491,TH,11880.00,1X20RF EPOXY ENCAPSULATION COMPOUND,"49,738.79",2689755.00
20-Mar,SHINDENGEN PHILIPPINES CORPORATION,PANASONIC MANUFACTURING AYUTHAYA CO,MOL HORIZON V. 1101E,MOLU13807478888,TH,11890.00,1X20RF EPOXY ENCAPSULATION COMPOUND,"48,708.86",2624481.00
14-Mar,SHINDENGEN PHILIPPINES CORPORATION,PANASONIC MANUFACTURING AYUTHAYA CO,MOL HOPE V. 0042E,MOLU13807478872,TH,11880.00,1X20RF EPOXY ENCAPSULATION MATERIALS,"48,858.77",2626884.00
7-Mar,CHAROEN POKPHAND FOODS PHILS. CORP.,DANISCO SINGAPORE PTE. LTD.,NORTHERN DIAMOND,MCB162398,SG,14000.00,1X40 CONT STC 15 PALLETS AXTRA PHY 5000 L,"101,594.40",5454783.00
16-Mar,MEGASOFT HYGIENIC PRODUCTS INC,SHENZHEN GUI HAO CHENG TRADE,MAGNAVIA,193507,CN,20412.00,1X40 CTR STC ADHESIVE H4394,"25,370.42",1337521.00
8-Mar,MEGASOFT HYGIENIC PRODUCTS INC,SHENZHEN GUI HAO CHENG TRADE,HANSA FALKENBURG,68788,CN,21283.00,"1X40 CTR STC ADHESIVE TEP 517, TEP 876","26,303.50",1386056.00
26-Mar,INGREDION PHILIPPINES INC.,INGREDION INC,OOCL HO CHI MINH CITY V021W,OOLU2101414820,US,18449.00,1X40 GP STC COLFLO 67 TRUETRACE IP  BATTER B,"17,079.69",933515.00
16-Mar,INGREDION PHILIPPINES INC.,INGREDION INC,NYK TRITON V 069W,NYKSCHITK4650100,US,18371.00,1X40GP CNTR STC THERMTEX TRUETRACE IP,"19,954.15",1086467.00
23-Mar,JEBSEN & JESSEN INGREDIENTS (P),VEDAN VIETNAM ENTERPRISE CORP. LTD,BRIDGE 002B,OOLU2601362620,VN,36000.00,2 X 20 STC MODIFIED STARCH ACETYLATED DISTAR,"25,568.22",1349682.00
6-Mar,SAVE EARTH TECHNOLOGIES AND SERVICE,BIO-SYSTEMS INTERNATIONAL,COLOMBO V.037S,44393,US,1160.00,"250 PAILS PC+,4 X 2LB CUBES PER PAIL ENZYMES","24,210.46",1305665.00
6-Mar,SHINDENGEN PHILIPPINES CORPORATION,PANASONIC MANUFACTURING AYUTHAYA CO,MOL HORIZON V.1100E,MOLU13807447505,TH,23760.00,2X20 RF CTNR EPOXY ENCAPSULATION MATERIAL,"91,593.17",4939350.00
20-Mar,DKSH PHILIPPINES INC.,"SMS CORPORATION CO., LTD.",SITC LAEM CHABANG,SITGBKMN104752,TH,39000.00,2X20 STC 1560 BAGS KREATION MB MODIFIED STAR,"25,925.40",1366498.00
27-Mar,SHINDENGEN PHILIPPINES CORPORATION,PANASONIC MANUFACTURING AYUTHAYA CO,MOL HOPE V. 0043E,MOLU13807478893,TH,25371.00,2X20RF EPOXY ENCAPSULATION MATERIAL,"89,669.72",4833703.00
8-Mar,MAGNOLIA INC.,VRS FOODS LIMITED,HYUNDAI SPLENDER,SFP180163587,IN,50000.00,2X40 CONTRS STC: (2000 BAGS) RENNER CASEIN-9,"299,575.52",15789990.00
2-Mar,JEBSEN & JESSEN INGREDIENTS (P),VEDAN VIETNAM ENTERPRISE CORP LTD,AMALIA C 038B,OOLU2600395320,VN,54000.00,3 X 20 STC MODIFIED STARCH [ DISTARCH PHOSPH,"33,490.78",1765089.00
15-Mar,INLAND WAREHOUSING & LOGISTICS DIV.,"THREEBOND CO., LTD",CAPE NABIL V.034S,NYKSTY6AG8363400,JP,640.00,313 NE THREEBOND BRAND PRODUCTS (TB2236C/T,"11,251.66",619433.00
23-Mar,INGREDION PHILIPPINES INC.,PT. INGREDION INDONESIA,GH ZONDA 802A,MCB175653,US,4994.00,32233103CA NATIONAL 78-0432(modified starch),"16,511.66",896944.00
23-Mar,TURRIS PHIL. INC.,TATE & LYLE INGREDIENTS AMERICAS,YM MUTUALITY,NYKSCHIU06794400,US,38556.00,34 PACKAGES 1700 BAGS  MODIFIED STARCH,"39,519.90",2139939.00
24-Mar,INLAND WAREHOUSING & LOGISTICS DIV.,THREE BOND MANUFACTURING (THAILAND),SITC LIAONING,BKK0667388,TH,3394.00,340 PE THREEBOND BRAND PRODUCTS(TB3089H/TB,"207,830.38",11391778.00
13-Mar,HAMBURG TRADING CORPORATION,CARGILL DEUTSCHLAND GMBH,SOFIA EXPRESS V.044E,NYKSHAMU00283300,DE,51000.00,3X20 CONTAINER STC: 2040 BAGS C TEX 06205 AC,"45,086.40",2432882.00
26-Mar,MEGASOFT HYGIENIC PRODUCTS INC,SHENZHEN GUI HAO CHENG TRADE,HANSA SEIGBURG,16266,CN,61236.00,"3X40 CTR STC ADHESIVE H4394, TEP517","78,724.69",4141934.00
8-Mar,STARKEN PHILIPPINES INC.,STARKEN AAC SDN. BHD.,MV BUXMELODY,EGLV091830058242,MY,78585.00,3X40HC CONTR STC 1950 PCS THIN BED ADHESIVE,"14,428.50",826934.00
1-Mar,HAMBURG TRADING CORPORATION,CARGILL DEUTHCHLAND GMBH,NYK EAGLE V.008E,NYKSHAMT64238500,DE,71225.00,4 X 20 CONTAINERS STC 2849 BAGS C TEX 06214,"60,921.71",3304322.00
21-Mar,JEBSEN & JESSEN INGREDIENTS (P),VEDAN VIETNAM ENTERPRISE CORP. LTD,ST EVER,OOLU2601062570,VN,72000.00,4 X 20 STC MODIFIED STARCH [DISTARCH PHOSPHA,"44,654.37",2351526.00
8-Mar,EDWARD KELLER (PHILS.) INC.,"SMS CORPORATION CO., LTD.",SITC GUANGDONG 1803N,1MNL18020166,TH,4000.00,4PLTS STC 160 BAGS KREATION TU10,"5,137.90",274077.00
16-Mar,CENTURY PACIFIC FOOD INC.,GENERAL STARCH LIMITED,MOL HOPE,BKKCB18002505,TH,20000.00,800 BAGS MODIFIED TAPIOCA STAR,"16,473.20",867483.00
15-Mar,MEAD JOHNSON NUTRITION (PHILS) INC,KERRY INGREDIENTS (IRELAND) LTD,COSCO SPAIN,IEORK4017804563,IE,16800.00,9075 ULTRANOR MILK PROTEIN ISOLATE,"185,123.36",9758154.00
21-Mar,DOLE PHILIPPINES INC,NOVOZYMES MALAYSIA SDN BHD,WAN HAI 101 V.N112,01PKG0121520,MY,960.00,PECTINEX ULTRA TROPICAL,"9,600.00",541725.00
27-Mar,SUPERSTAR COCONUT PRODUCTS CO. INC,SAN SOON SENG FOOD INDUSTRIES,KMTC TIANJIN 1802N,PKG1410385,MY,16000.00,AAA MALTODEXTRIN,"13,812.00",753781.00
19-Mar,HENKEL PHILIPPINES INC.,HENKEL CHEMICAL TECHNOLOGIES,TORRES STRAIT VOY 1807,SHA823478,CN,3386.00,"ADHESIVE (TECHNOMELT 3183 25KG,","11,520.92",605532.00
21-Mar,JT INTERNATIONAL ASIA MFG. CORP.,H.B. FULLER ADHESIVES MALAYSIA SDN,XIN QIN HUANG DAO 042E,PKGSGL000401,MY,3675.00,ADHESIVE DURABOND-CONTROLLED,"10,257.12",571724.00
19-Mar,MAHLE FILTER SYSTEMS PHILS. CORP.,MAHLE FILTER SYSTEMS JAPAN CORP GLO,CAPE NABIL 034S,33034,JP,10000.00,ADHESIVE OF 418P-3,"22,846.78",1254895.00
2-Mar,SAN TECHNOLOGY INCORPORATED,CORAL SERVICE CORP.,CALLAO BRIDGE 125S,UKBMNL18025188,JP,900.00,ADHESIVE POWDER,"19,302.75",1046257.00
5-Mar,TRANS WORLD TRADING COMPANY,TOYOCHEM SPECIALTY CHEMICAL SDN.BHD,BUXMELODY V1647-094N,EGLV091830038381,MY,16000.00,ADHESIVE TM-585-60M-DM-PH,"59,328.20",3106236.00
7-Mar,PRINCEACE CORP.,NILOS GMBH & CO,COLOMBO EXPRESS,DEHAM1801REM20093,DE,400.00,"ADHESIVE TOPGUM TL-T70, PRIMER SH","8,243.02",452666.00
9-Mar,PAREXGROUP INC.,EMFI SAS,SCIO SKY V. 1805,AME65ME884079,BE,10534.00,ADHESIVES (LANKO 603 PH GREY),"36,570.87",2007159.00
9-Mar,H.B FULLER (PHILIPPINES) INC.,H.B FULLER (CHINA) ADHESIVES LTD,BO YUN V.178,0248A05585,CN,6660.00,ADVANTRA 8621,"22,809.13",1192371.00
27-Mar,LAMON BAY FURNITURE CORP,"AICA KOGYO CO., LTD.",CALLAO BRIDGE V. 126S,KBMN18033104,JP,2500.00,AICA AIBON ADHESIVE,"6,411.14",357262.00
14-Mar,1986 CONSTRUCTION SUPPLY,SHENZHEN GUI HAO CHENG TRADE C,MAGNAVIA,42988,CN,1570.00,AIRCON MATERIALS INSULATION BOARD,"6,565.25",347707.00
2-Mar,ALLTECH BIOTECHNOLOGY CORP,"CUSTOM FREIGHT SALES, INC.",EVER LISSOME 023W,CVGMNN7911092D,US,2000.00,ALLZYME FD,"16,184.92",879297.00
5-Mar,ALLTECH BIOTECHNOLOGY CORP,ALLTECH BIOTECHNOLOGY CORP LTD,ITAL MILLIONE 0813 091W,EGLV050800043746,TH,1500.00,ALLZYME SSF E,"12,134.91",656359.00
9-Mar,ALLTECH BIOTECHNOLOGY CORP,"CUSTOM FREIGHT SALES, INC.",EVER LOGIC 029,CVGMNN8911139D,US,2000.00,ALLZYME VEGPRO,"11,680.84",634685.00
20-Mar,PHILIPPINE FOREMOST MILLING,MUEHLENCHEMIE GMBH AND CO KG,CMA CGM LAPEROUSE 088FME,HBG1223185,DE,2275.00,ALPHAMALT ROX HCTE VC5000,"19,839.05",1068401.00
2-Mar,PURATOS PHILIPPINES INC.,PURATOS NV,THALASSA TYHI 0962 018E,OOLU4026449670,BE,835.00,"AMYLASE FONGIQUE,PREMIX SOFTR SWEET,PREMIX X","18,974.02",1020606.00
27-Mar,VET SPECIALISTS INC,ALIVIRA ANIMAL HEALTH LIMITED,OOCL NINGBO V132E,3640,IN,5750.00,ANIMAL HEALTH PRODUCTS,"17,302.40",941244.00
21-Mar,KRAYDEN ASIA INC.,HUNTSMAN ADVANCED MATERIALS,THALASSA DOXA 018E,B1800570,BE,3037.00,ARALDITE,"20,994.96",1155280.00
27-Mar,TRANS-MILLENNIUM MERCANTILE CORPORA,CEREAL TECH PTE LTD.,CALICANTO BRIDGE,KMSMNL18EMA004,SG,5472.00,BAKERY INGREDIENTS CT TINAPASE,"12,141.67",638685.00
21-Mar,PHILIPPINE INDUSTRIAL SEALANTS &,THE DOW CHEMICAL COMPANY,KYAUK PHYU STAR 001S,KKLUUS0580953,US,13793.00,BETASEAL (TM) U-818 URETHANE SEALANT,"80,412.89",4410387.00
12-Mar,STT PHILIPPINES INC,"ELKEM SILICONES SHANGHAI CO.,",ISAO V.1804S,SNL8SHPL3100238,CN,12000.00,BLUESIL TCS 7525 AR/B (RAW MATERIALS),"109,480.80",5987110.00
21-Mar,STT PHILIPPINES INC,"ELKEM SILICONES SHANGHAI CO.,",HAI LIAN V.1806S,SITGSHMNL02181,CN,12000.00,BLUESIL TCS 7525 AR/B (RAW MATERIALS),"109,432.94",5997381.00
15-Mar,HENKEL PHILIPPINES INC.,HENKEL CHEMICAL TECHNOLOGIES,TORRES STRAIT VOY 1807,SHA100459,CN,3987.00,BONDERITE L-AD 900B 180KG EXPORT,"13,341.49",733926.00
9-Mar,SANKYOTATEYAMA PHILIPPINES INC,"SANKYO TATEYAMA, INC.",IWASHIRO 252S,81740,JP,319.00,"BOTH SIDES ADHESIVE TAPE, AIR TIGHT WB7739 V","5,176.38",284420.00
13-Mar,CARGILL TEXTURIZING SOLUTIONS,CARGILL DEUTSCHLAND GMBH,CALICANTO BRIDGE V. 250N,MOLU28014575286,BE,14825.00,C HIFORM 12748 COLD SWEL HYDROX DSTARCH PHOS,"39,582.75",2135934.00
9-Mar,HAMBURG TRADING CORPORATION,CARGILL INCORPORATED,IWASHIRO V.252S,NYKSCHIU02585500,US,32500.00,C TEX 06205 MODIFIED STARCH,"28,728.69",1556572.00
23-Mar,CARGILL TEXTURIZING SOLUTIONS,"CARGILL BIO-CHEMICAL CO., LTD",TRF PRAIA V. 280,XDFF301923,CN,19875.00,C*STABITEX 05311,"13,224.83",700809.00
23-Mar,FORGEMS MARKETING CO. INC.,GRAIN PROCESSING CORPORATION,EVER ETHIC V.1022W,MALY00596829,US,47628.00,C12F ACID MODIFIED CORN STARCH,"24,110.29",1314867.00
26-Mar,CARGILL TEXTURIZING SOLUTIONS,CARGILL INCORPORATED,KYAUK PHYU STAR V. 001N,KKLUUS0579598,US,19278.00,CARGILL TEX 062311 MOD FOOD STARCH,"17,735.28",969431.00
31-Mar,WU KONG SINGAPORE PTE. LTD. PHIL.,NEDEX CHEMIE DEUTSCHLAND GMBH,CALICANTO BRIDGE 251N,KKLUHAM492552,NL,15936.00,CHEMICAL HARMLESS,"56,058.68",3171705.00
1-Mar,HITACHI CABLE PHILIPPINES INC.,HITACHI TRANSPORT SYSTEM EAST,CALLAO BRIDGE 125S,YOKACC05581,JP,291.00,"CHEMLOK, CHEMLOK 6108","13,389.41",736943.00
15-Mar,H.B FULLER (PHILIPPINES) INC.,H.B FULLER ADHESIVE MALASYIA SDN BH,CMA CGM VERDI V.248E,PKGSGL000392,MY,10800.00,CLEANMELT PHC 7256,"28,289.90",1481676.00
20-Mar,BRENNTAG INGREDIENTS INC.,ROQUETTE ITALIA SPA,OOCL EGYPT V 012E,OOLU4045126600,IT,38000.00,CLEARAM CH 20 20,"41,406.11",2237689.00
12-Mar,NUTRI-ASIA INC.,ROQUETTE ITALIA SPA,TAIPEI TRIUMPH 0316-003E,OOLU4045025770,IT,19000.00,CLEARAM CH 20 20 (MODIFIED STARCH ),"16,452.21",892753.00
16-Mar,NUTRI-ASIA INC.,ROQUETTE ITALIA SPA,CMA CGM CASSIOPEIA 266MEE,OOLU4045005180,IT,19000.00,"CLEARAM CH 2020, maize modified starch","16,452.06",892745.00
13-Mar,BRENNTAG INGREDIENTS INC.,ROQUETTE ITALIA SPA,CMA CGM CASSIOPEIA 266MEE,OOLU4045089880,IT,19000.00,CLEARAM CH 40 20,"24,347.52",1314768.00
8-Mar,KINPO ELECTRONICS (PHILIPPINES) INC,ATOM CELS SINGAPORE PTE LTD,NYK JOANNA V 064N,84469,SG,450.00,CONFORMAL COATING,"29,130.19",1601927.00
22-Mar,BOUNTY FRESH FOODS INC,DSM NUTRITIONAL PRODUCTS ASIA,KOTA JUTA,SINCB18006824,DE,5000.00,CRINA POULTRY FEED ADDITIVE POWDER,"140,000.00",7532652.00
6-Mar,INGREDION PHILIPPINES INC.,NATIONAL STARCH AND CHEMICAL,MOL HORIZON 1100E,MOLU13807413845,TH,46250.00,CRISPIOCA NATIONAL 8991,"50,530.80",2652594.00
9-Mar,INGREDION PHILIPPINES INC.,NATIONAL STARCH AND CHEMICAL,MOL SPARKLE 1067N,MOLU13807526590,TH,17977.00,CRISPIOCA/NATIONAL FRIGEX/PURITY 77HV,"17,618.00",926936.00
19-Mar,REPUBLIC CHEMICAL INDUSTRIES INC.,MOMENTIVE  PERFORMANCE MATERIA,MOL SEABREEZE V. 0103N,GTD0393280,TH,14695.00,CRTV 1490E-DRUM SILICONE SEALANT BULK ACETOX,"68,658.30",3588203.00
19-Mar,GCP APPLIED TECHNOLOGIES,HENKEL (THAILAND) LTD.,MOL HORIZON 1101E,MOLU13807539350,TH,6940.00,"DAREX DRUM 159V, DAREX OP649DE-40","9,336.79",515187.00
23-Mar,INGREDION PHILIPPINES INC.,INGREDION INC,MOL PRESTIGE 048W,NYKSCHIU01380400,US,18371.00,DEXTRINS & OTHER MODIFIED STARCH (THERMTEX T,"19,954.15",1088674.00
28-Mar,INGREDION PHILIPPINES INC.,INGREDION INC,MOL PROSPERITY 113W,NYKSCHIU25039400,US,18371.00,DEXTRINS AND OTHER MODIFIED STARCHES(THERMTE,"19,954.15",1088674.00
15-Mar,ELEMATEC PHILIPPINES INC,ELEMATEC CORPORATION,CAPE NABIL 034S,92380,JP,910.00,DRY SURF,"25,520.02",1393056.00
21-Mar,MEGAPAINT CORPORATION,"AKZO NOBEL PAINTS VIET NAM LTD.,",MOL HORIZON 1100W,SGNMNLS1803015,VN,20000.00,DS PUTTY 40K/A502-29133,"5,625.38",303624.00
26-Mar,UNIVERSAL ROBINA CORPORATION,PB LEINER ARGENTINA SA,CAPE ARTEMISIO V752E,BUEMNLI00080,AR,20800.00,EDIBLE BEEF GELATIN,"113,225.60",6101129.00
20-Mar,ASCO MARKETING CORPORATION,PARMOVO S.R.L.,MUNCHEN BRIDGE,PMF802314053,IT,10000.00,EGG WHITE POWDER EWPHW3,"80,541.50",4338292.00
12-Mar,SWITZ MARKETING CORPORATION,OVOBEL FOODS LIMITED,CMA CGM VERDI 248E,MAACB18001428,IN,5000.00,EGG WHITE POWDER HIGH WHIP,"37,000.00",1951003.00
13-Mar,INGREDION PHILIPPINES INC.,NATIONAL STARCH AND CHEMICAL,MOL HOPE 0042E,MOLU13807423252,TH,116672.00,ELASTIGEL 3000M/INSTANT PURE-FLO,"136,980.93",7152481.00
12-Mar,INGREDION PHILIPPINES INC.,NATIONAL STARCH AND CHEMICAL,MOL HOPE 0042E,MOLU13807423329,TH,162000.00,ELASTIGEL 3000MELASTITEX 1,"111,812.40",5861364.00
8-Mar,AMPERE RESOURCES CORPORATION,BDP ASIA PACIFIC PTE LTD,NYK JOANNA 064N,8101020366A,SG,4164.00,"ELASTOMETRIC FIRESRTOP SPRAY, ENDOTHERMIC","32,114.33",1758113.00
28-Mar,PHILIPPINE FLOUR MILLS (A DIVISION,MUEHLENCHEMIE GMBH & CO. KG,SEASPAN ZAMBEZI V. 008E,MNL215869,DE,5000.00,"ELCO P-100 K, EMCEFERRO ELECTROLYTIC","78,387.74",4219657.00
23-Mar,ALTERNATIVES FOOD CORP,"QINGDAO LANKANG INTERNATIONAL CO.,",PHILIPPA SCHULTE,AAJY008664,TR,75000.00,EMPRO 90 ISOLATED SOY PROTEIN (EMULSION GRA,"78,600.00",4187166.00
23-Mar,ALTERNATIVES FOOD CORP,"QINGDAO LANKANG INTERNATIONAL CO.,",COSCO FUKUYAMA,COAU7042148430,TR,75000.00,EMPRO 90 ISOLATED SOY PROTEIN (EMULSION GRA,"78,600.00",4187166.00
26-Mar,AMPERE RESOURCES CORPORATION,BDP ASIA PACIFIC PTE LTD,NYK JOANNA 065N,30108,SG,3314.00,"ENDOTHERMIC FIRESTOP SEALANT, INTUMISCENT","33,300.66",1825874.00
8-Mar,SAN MIGUEL BREWERY INC,NOVOZYMES MALAYSIA SDN BHD,NYK JOANNA V. 064N,01PKG0120751,US,13200.00,"ENZYMES (ATTENUZYME CORE, TERMAMYL SC DS, UL","115,382.20",6189127.00
13-Mar,JTK ELECTRONIC COMPONENTS,WELLS ELECTRONIC MATERIAL,SITC SHANDONG,SZHOE18035719,CN,1990.00,EPOXY ADHESIVE,"10,609.26",586271.00
10-Mar,SIIX LOGISTICS PHILS. INC.,SIIX CORP. TOKYO HEADQUARTER,IWASHIRO 252S,64400,JP,275.00,EPOXY RESIN,"6,418.53",353874.00
6-Mar,SIIX LOGISTICS PHILS. INC.,SIIX CORP. TOKYO HEADQUARTER,WAN HAI 313 S169,63582,JP,6985.00,"EPOXY RESIN, HARDENER","38,083.73",2089531.00
1-Mar,YAZAKI-TORRES MANUFACTURING INC.,YAZAKI  CORPORATION,CALLAO BRIDGE 125S,NYKSSM7AA7206700,JP,844.00,"E-TEC, ADHESIVE, SILICON SEALANT","18,738.59",1031694.00
8-Mar,YAZAKI-TORRES MANUFACTURING INC.,YAZAKI  CORPORATION,IWASHIRO 252S,NYKSSM7AA7207100,JP,657.00,"E-TEC, ADHESIVE, SILICON SEALANT","15,206.78",834030.00
22-Mar,YAZAKI-TORRES MANUFACTURING INC.,YAZAKI  CORPORATION,KYAUK PHYU STAR V.001N,NYKSSM7AA7501500,JP,552.00,"E-TEC, ADHESIVE, SILICON SEALANT","12,063.02",661452.00
14-Mar,YAZAKI-TORRES MANUFACTURING INC.,YAZAKI  CORPORATION,CAPE NABIL 034S,NYKSSM7AA7499700,JP,1816.00,"E-TEC, SILICON SEALANT","30,218.69",1651601.00
28-Mar,INTERNATIONAL FLAVORS AND FRAGRANCE,DSM FOOD SPECIALTIES,CALICANTO BRIDGE V.251N,SEMNL1803035905,DE,1280.00,EXPRESA 2200 GF POWDER,"9,795.20",522525.00
8-Mar,HILTI PHILIPPINES INC.,HILTI AG,COLOMBO EXPRESS,MNL215823,DE,917.00,FILLING FOAM,"6,301.86",345725.00
19-Mar,JANGHO GROUP CO LTD PHILIPPINE BRAN,GUANGZHOU JANGHO CURTAIN WALL,SINAR BRANI,CAMNZXE34557,CN,1230.00,FIREPROOF GLUE,"8,341.01",458487.00
14-Mar,FISCHER PH ASIA INC,FISCHERWERKE GMBH & CO KG,MARSTAL MAERSK MAE5237,STRMNLI00076,DE,9776.00,FIXING MATERIAL FIAM600 FIRESTOP AND ACOUSTI,"27,781.95",1523023.00
9-Mar,MCCORMICK PHILIPPINES INC,RUBECLAR INTERNATIONAL INC.,YM MOBILITY V. 031W,W160337098,US,273.00,"FRUTAROM PAPAIN PURIFIED POWDER S-100,","9,120.11",491084.00
1-Mar,OHGITANI PHILIPPINES INC.,OHGITANI CORPORATION,CALLAO BRIDGE 125S,KMN6360,JP,1907.00,FUJIMI OPTICAL EMERY MINUTE POWDER,"7,496.84",400716.00
12-Mar,3M PHILS. INC.,3M SHANGHAI SPECIALTY MATERIAL,ISAO 1804S,2021,CN,1600.00,GCLF 467MP 50 IN 2500M PRODU,"8,032.23",444501.00
7-Mar,SUCERE FOODS CORPORATION,ROUSSELOT (M) SDN BHD,NYK JOANNA,HDMUSGWB0538084,BR,20000.00,GELATIN 220 H 20,"132,520.00",7127295.00
7-Mar,MARKENBURG INTERNATIONAL FOODS CORP,ROUSSELOT SDN BHD,NYK JOANNA 064N,HDMUSGWB0538083,SG,20000.00,GELATIN 220 H 20,"112,190.00",6037652.00
20-Mar,GANDANG KALIKASAN INC.,"GANDANG KALIKSAN, INC. USA",OOCL HO CHI MINH CITY 021W,S00300405,US,200.00,GLUADIN,"8,884.04",468046.00
26-Mar,HOMEBASE TRADING & GEN MERCHANDISE,XIAMEN XINYUANCHANG IMPORT & EXPORT,HE SHENG 1811S,MCLPWET017217,CN,6000.00,GLUE,"10,357.52",545820.00
23-Mar,HOMEBASE TRADING & GEN MERCHANDISE,SHENZHEN LUYE EAST INDUSTRY CO LTD,MAGNAVIA 18006S,50525,CN,4500.00,GLUE,"9,235.10",487130.00
14-Mar,HOMEBASE TRADING & GEN MERCHANDISE,"SHENZHEN SPEEDY IMP & EXP CO., LTD.",MAGNAVIA 18005S,38056,CN,4500.00,GLUE,"7,665.05",403637.00
23-Mar,TAIPHIL PROTECH INDUSTRIAL INC.,NEW VISTA LIMITED,MAGNAVIA 18006S,HKGMNL183164,HK,59.00,GLUE,"5,257.23",289436.00
9-Mar,STT PHILIPPINES INC,STT INC.,IWASHIRO 252S,YOKACB77835,JP,9072.00,"GLUE SE6750 A,GLUE SE6750B","130,564.22",7021728.00
26-Mar,SYNERGY SALES INTERNATIONAL CORP,XIAMEN QICHEN IMPORT & EXPORT,MS EAGLE V-1807,26074,CN,22000.00,GLUE STARCH AS PER INV#XG180313 dtd. 3/13/20,"12,020.00",638011.00
27-Mar,MCGK WOODWORKS INC.,AKZO NOBEL ADHESIVE PTE LTD,KOTA JUTA V.0325E,SWMNL1850296,SG,2795.00,GLUE/HARDENER,"11,893.45",657949.00
13-Mar,BRENNTAG INGREDIENTS INC.,DUPONT NUTRITION BIOSCIENCES,MARY MAERSK V 804E,9810,DK,380.00,GRINDAMYL H 490,"9,279.01",499891.00
9-Mar,H.B FULLER (PHILIPPINES) INC.,H. B. FULLER ADHESIVES MALAYSIA SDN,FELIXSTOWE BRIDGE 059E,PKGSGL000389,MY,9100.00,GRIPWELL 1201 (INDUSTRIAL ADHESIVES),"16,720.21",875813.00
15-Mar,INGREDION PHILIPPINES INC.,NATIONAL STARCH AND CHEMICAL,MOL SEABREE 0103N,MOLU13807527690,TH,51654.00,H50/ INSTANT PURE FLO F / NATIONAL,"65,010.89",3394871.00
13-Mar,ALL INCLUSIVE SALES INC.,AMERSEAL INDUSTRIAL SDN BHD,EVER BALMY,EGLV095800014045,MY,1512.00,HARDEX BETA GREY RTV SILICONE GASKET MAK 40G,"11,442.22",597484.00
13-Mar,ALL INCLUSIVE SALES INC.,AMERSEAL INDUSTRIAL SDN BHD,EVER BALMY,EGLV095800014045,MY,6952.00,HARDEX BETA GREY RTV SILICONE GASKET MAK85.2,"34,580.94",1803243.00
5-Mar,BOSTIK PHILIPPINES INC.,JIANGSU BOSTIK ADHESIVE CO. LTD,HAI LIAN V.1804S,JYDSH180205062F,CN,3000.00,HERBERTS 1K-LF190-X3 (ADHESIVE),"14,502.47",759179.00
13-Mar,HILTI PHILIPPINES INC.,HILTI CORPORATION,GL LESTE 804A,SGSIN0000086147,SG,53196.00,"HILTI FIXING EQUIPMENT ADHESIVE CAPSULE, FS","155,072.72",8501342.00
26-Mar,HILTI PHILIPPINES INC.,HILTI CORPORATION,CHILOE ISLAND 806A,SGSIN0000086388,SG,1546.00,HILTI FIXING EQUIPMENT INJECTABLE MORTAR,"32,873.32",1801186.00
26-Mar,HILTI PHILIPPINES INC.,HILTI CORPORATION,CHILOE ISLAND/806A,SGSIN0000086461,SG,14010.00,"HILTI FIXING EQUIPMENT, CAPSULE,FS JOINT FIL","106,135.85",5817485.00
8-Mar,HILTI PHILIPPINES INC.,HILTI CORPORATION,GUENTHER SCHULTE 804A,SGSIN0000085583,SG,4368.00,"HILTI FIXING EQUIPMENT-INJECTABLE MORTAR,ADH","69,908.99",3834933.00
23-Mar,AKAGI GOMU PHILS. CORP.,"AKAGI CO., LTD.",CALLAO BRIDGE 126S,YLKS8011080,JP,3189.00,HOT MELT,"13,154.94",723337.00
2-Mar,AKAGI GOMU PHILS. CORP.,"AKAGI CO., LTD.",CALLAO BRIDGE 125S,YLKS8007467,JP,2781.00,HOT MELT,"10,966.20",604786.00
9-Mar,SIGLO LEATHERWARE MANUFACTURING INC,SHEN ZHEN GNG CO LTD.,APL LOS ANGELES V. 27S,750800135A,CN,1835.00,HOT MELT ADHESIVE,"20,623.25",1131634.00
1-Mar,MYSTIC FABRIC ENTERPRISE,ADTEK MALAYSIA SDN BHD,BUXMELODY V.094N,SNKO160180100308,MY,20757.00,HOT MELT ADHESIVE,"16,551.20",924563.00
9-Mar,CONSOLIDATED ADHESIVES INC,ADTEK MALAYSIA SDN BHD,NORTHERN VALENCE 046N,SNKO160180100228,MY,17000.00,HOT MELT ADHESIVE (GLUE),"34,340.00",1801957.00
20-Mar,NAN PAO RESINS CHEMICAL PHILIPPINES,FOSHAN NAN PAO ADVANCED MATERIALS C,JIAN GONG 618 180312,FOSCB18000169,CN,10800.00,HOT MELT ADHESIVE HM 242,"24,495.71",1282804.00
23-Mar,H.B FULLER (PHILIPPINES) INC.,H.B FULLER (CHINA) ADHESIVES LTD,YONG SHI FENG 66 V.18031200,0248A06381,CN,9600.00,HOT MELT ADHESIVES NW-1151ZP,"32,388.48",1785188.00
8-Mar,PROCTER & GAMBLE PHILIPPINES INC,HENKEL CHEMICAL TECHNOLOGIES (SHANG,ISAO V.1804S,547,CN,8640.00,HOTMELT ADHESIVE,"40,002.69",2194194.00
23-Mar,PROCTER & GAMBLE PHILIPPINES INC,HENKEL CHEMICAL TECHNOLOGIES (SHANG,ISAO V.1805S,6962,CN,8640.00,HOTMELT ADHESIVE,"39,963.19",2199854.00
19-Mar,COPYLANDIA OFFICE SYSTEMS CORP.,HORIZON INTERNATIONAL INC.,CAPE NABIL 034S,UKBMNN13414,JP,1098.00,HOTMELT GLUE-CONSUMABLES OF BINDING MACHINE,"10,428.61",572878.00
19-Mar,BOSTIK PHILIPPINES INC.,BOSTIK FINDLEY CHINA CO. LTD.,MAGNAVIA 18005S,39445,CN,10825.00,HOTMELT H4376 AND HOTMELT TEE258,"37,705.04",2073510.00
15-Mar,ROMTECH CONSTRUCTION INC,ARDEX SINGAPORE PTE LTD,FELIXSTOWE BRIDGE V 059E,SGMNL1801640,SG,6305.00,INDUSTRIAL FLOORING PRODUCTS ARDEX,"44,793.05",2464174.00
14-Mar,HILTI PHILIPPINES INC.,HILTI CORPORATION,CMA CGM VERDI 248E,OOLU2600687660,SG,1159.00,INJECTABLE MORTAR,"24,123.18",1317249.00
19-Mar,LLOYD LABORATORIES INC.,INGREDION INC.,NYK TRITON,NYKSCHIU18085700,US,6129.00,INSTANT TEXTRA DEXTRINS & OTHER MODIFIED STA,"39,463.79",2123793.00
2-Mar,COMMODITY QUEST INC.,DEZHOU RUI KANG FOOD CO LTD,HYUNDAI FORWARD 079S,SSLMN180744,CN,100000.00,ISOLATED SOY PROTEIN,"225,198.98",11783829.00
23-Mar,COMMODITY QUEST INC.,"DEZHOU RUIKANG FOOD CO., LTD",PHILIPPA SCHULTE V093XAS,SSLMN180930,CN,100000.00,ISOLATED SOY PROTEIN,"224,380.00",11754196.00
28-Mar,DKSH PHILIPPINES INC.,ARCHER DANIELS MIDLAND CO,ER TEXAS V009S,COSU8018367400,US,6000.00,ISOLATED SOY PROTEIN PROFAM 921,"24,127.79",1277677.00
15-Mar,COMMODITY QUEST INC.,SHANDONG GUSHEN IMPORT EXPORT CO LT,SITC MAKASSAR 1806S,SITGTAMN578028,CN,50000.00,ISOLATED SOY PROTEIN SOYA PRO 900,"110,921.00",5808068.00
5-Mar,BOSTIK PHILIPPINES INC.,JIANGSU BOSTIK ADHESIVE CO. LTD,HAI LIAN V.1804S,JYDSH180205062F,CN,1905.00,ISR 70-03 BLACK,"9,205.26",507264.00
9-Mar,SIKA PHILIPPINES INC.,SIKA LTD,IWASHIRO 252S,YHMNL00700418JP,JP,2449.00,JOINT SEALANT SIKAFLEX 255 EXTRA BLACK 600ml,"13,057.75",685800.00
2-Mar,BORAL PLASTERBOARD PHILIPPINES INC.,USG BORAL SDN BHD,BUXMELODY 1647 094N,EGLV090800018911,MY,82096.00,JOINTING COMPOUND PREMIUM PREMIX,"25,268.56",1346905.00
9-Mar,BORAL PLASTERBOARD PHILIPPINES INC.,USG BORAL SDN BHD,NORTHERN VALENCE 1648 046N,EGLV090800038491,MY,82096.00,JOINTING COMPOUND PREMIUM PREMIX,"25,268.56",1339138.00
20-Mar,BORAL PLASTERBOARD PHILIPPINES INC.,USG BORAL SDN BHD,MAIN TRADER 1649 038N,EGLV090800038504,MY,82096.00,JOINTING COMPOUND PREMIUM PREMIX,"25,268.56",1341971.00
22-Mar,BORAL PLASTERBOARD PHILIPPINES INC.,USG BORAL SDN BHD,EVER BLISS 1650 009N,EGLV090800038512,MY,82096.00,JOINTING COMPOUND PREMIUM PREMIX,"25,268.56",1343844.00
29-Mar,BORAL PLASTERBOARD PHILIPPINES INC.,USG BORAL SDN BHD,BUXMELODY 1651 095N,EGLV090800049166,MY,82096.00,JOINTING COMPOUND PREMIUM PREMIX,"25,268.56",1343844.00
2-Mar,BORAL PLASTERBOARD PHILIPPINES INC.,USG BORAL SDN BHD,MAIN TRADER 1645 037N,EGLV090800018899,MY,39678.00,"JOINTING COMPOUND PREMIUM PREMIX, PREMIUM PR","12,647.66",677058.00
26-Mar,EUNICE INC.,ALISPED S.P.A,YM UBERTY 061E,201809,IT,4000.00,"KELIWOOL LIQUID, COLLAGEN HYDROLYSED 30%, KE","50,992.20",2688788.00
16-Mar,HOUSE TECHNOLOGY INDUSTRIES PTE.LTD,KLEBCHEMIE M G BECKER GMBH AND,COLOMBO 039S,N670186946,NL,13200.00,KLEIBERIT 502.8 METAL DRUM WITHLINLINER(WOOD,"65,197.82",3577501.00
